,movie_no,movie_name,movie_year,movie_certificate,movie_runtime,movie_genre,movie_score,movie_gross,movie_director,movie_star,movie_writer,tomatoter,audience
2194,2194,the wedding singer,1998,PG-13,100 min,"Comedy, Music, Romance",6.8,$80.25M,Frank Coraci,"Adam Sandler, Drew Barrymore, Christine Taylor, Allen Covert",,,
2195,2195,moving parts,2017,,106 min,"Action, Crime, Drama",5.5,,"Jerry Hayes, Harley Wallen","T.J. Storm, Harley Wallen, Calhoun Koenig, Michael Alexander",,,
2196,2196,footloose,2011,PG-13,113 min,"Comedy, Drama, Music",5.9,$51.80M,Craig Brewer,"Kenny Wormald, Julianne Hough, Dennis Quaid, Andie MacDowell",,,
2197,2197,evolution,2001,PG-13,101 min,"Comedy, Sci-Fi",6.1,$38.35M,Ivan Reitman,"David Duchovny, Orlando Jones, Julianne Moore, Seann William Scott",,,
2198,2198,empire records,1995,PG-13,90 min,"Comedy, Drama, Music",6.7,$0.30M,Allan Moyle,"Anthony LaPaglia, Debi Mazar, Maxwell Caulfield, Rory Cochrane",,,
2199,2199,birth of the dragon,2016,PG-13,95 min,"Action, Biography, Drama",5.3,$6.90M,George Nolfi,"Billy Magnussen, Yu Xia, Philip Ng, Jingjing Qu",,,
2200,2200,four brothers,2005,R,109 min,"Action, Crime, Drama",6.9,$74.49M,John Singleton,"Mark Wahlberg, Tyrese Gibson, Andr Benjamin, Garrett Hedlund",,,
2201,2201,[rec],2007,R,78 min,"Horror, Mystery, Thriller",7.5,,"Jaume Balaguer, Paco Plaza","Manuela Velasco, Ferran Terraza, Jorge-Yamam Serrano, Pablo Rosso",,,
2202,2202,buffy the vampire slayer,1992,PG-13,86 min,"Action, Comedy, Fantasy",5.6,$16.62M,Fran Rubel Kuzui,"Kristy Swanson, Donald Sutherland, Paul Reubens, Rutger Hauer",,,
2203,2203,hocus pocus,1993,PG,96 min,"Comedy, Family, Fantasy",6.8,$39.51M,Kenny Ortega,"Bette Midler, Sarah Jessica Parker, Kathy Najimy, Omri Katz",,,
2204,2204,only god forgives,2013,R,90 min,"Crime, Drama",5.7,$0.78M,Nicolas Winding Refn,"Ryan Gosling, Kristin Scott Thomas, Vithaya Pansringarm, Gordon Brown",,,
2205,2205,robin hood: men in tights,1993,PG-13,104 min,"Adventure, Comedy, Musical",6.7,$35.74M,Mel Brooks,"Cary Elwes, Richard Lewis, Roger Rees, Amy Yasbeck",,,
2206,2206,free state of jones,2016,R,139 min,"Action, Biography, Drama",6.9,$20.76M,Gary Ross,"Matthew McConaughey, Gugu Mbatha-Raw, Mahershala Ali, Keri Russell",,,
2207,2207,rush hour,1998,PG-13,98 min,"Action, Comedy, Crime",6.9,$141.15M,Brett Ratner,"Jackie Chan, Chris Tucker, Ken Leung, Tom Wilkinson",,,
2208,2208,perfectos desconocidos,2017,,97 min,Comedy,7.1,,lex de la Iglesia,"Beln Rueda, Eduard Fernndez, Ernesto Alterio, Juana Acosta",,,
2209,2209,102 dalmatians,2000,G,100 min,"Adventure, Comedy, Family",4.9,$66.96M,Kevin Lima,"Glenn Close, Grard Depardieu, Ioan Gruffudd, Alice Evans",,,
2210,2210,rust and bone,2012,R,120 min,"Drama, Romance",7.5,$2.06M,Jacques Audiard,"Marion Cotillard, Matthias Schoenaerts, Armand Verdure, Cline Sallette",,,
2211,2211,get hard,2015,R,100 min,"Comedy, Crime",6.0,$90.41M,Etan Cohen,"Will Ferrell, Kevin Hart, Alison Brie, T.I.",,,
2212,2212,killer joe,2011,R,102 min,"Crime, Drama, Thriller",6.7,$1.99M,William Friedkin,"Matthew McConaughey, Emile Hirsch, Juno Temple, Thomas Haden Church",,,
2213,2213,eraserhead,1977,Not Rated,89 min,Horror,7.4,$7.00M,David Lynch,"Jack Nance, Charlotte Stewart, Allen Joseph, Jeanne Bates",,,
2214,2214,chokeslam,2016,,102 min,Comedy,4.6,,Robert Cuffley,"Chris Marquette, Amanda Crew, Michael Eklund, Niall Matter",,,
2215,2215,days of heaven,1978,PG,94 min,"Drama, Romance",7.9,,Terrence Malick,"Richard Gere, Brooke Adams, Sam Shepard, Linda Manz",,,
2216,2216,for a few dollars more,1965,R,132 min,Western,8.3,$15.00M,Sergio Leone,"Clint Eastwood, Lee Van Cleef, Gian Maria Volont, Mario Brega",,,
2217,2217,paris can wait,2016,PG,92 min,"Comedy, Drama, Romance",5.8,$5.62M,Eleanor Coppola,"Diane Lane, Arnaud Viard, Alec Baldwin, Elise Tielrooy",,,
2218,2218,silverado,1985,PG-13,133 min,"Action, Crime, Drama",7.2,$33.20M,Lawrence Kasdan,"Kevin Kline, Scott Glenn, Kevin Costner, Danny Glover",,,
2220,2220,ella enchanted,2004,PG,96 min,"Comedy, Family, Fantasy",6.3,$22.92M,Tommy O'Haver,"Anne Hathaway, Hugh Dancy, Cary Elwes, Joanna Lumley",,,
2221,2221,winter's bone,2010,R,100 min,Drama,7.2,$6.53M,Debra Granik,"Jennifer Lawrence, John Hawkes, Garret Dillahunt, Isaiah Stone",,,
2222,2222,naked,2017,TV-14,96 min,"Comedy, Romance",5.3,,Michael Tiddes,"Marlon Wayans, Regina Hall, Dennis Haysbert, J.T. Jackson",,,
2223,2223,we bought a zoo,2011,PG,124 min,"Comedy, Drama, Family",7.1,$75.62M,Cameron Crowe,"Matt Damon, Scarlett Johansson, Thomas Haden Church, Elle Fanning",,,
2224,2224,the current war,2017,,105 min,"Biography, Drama, History",6.3,,Alfonso Gomez-Rejon,"Tom Holland, Katherine Waterston, Benedict Cumberbatch, Michael Shannon",,,
2225,2225,cinderella,1950,G,74 min,"Animation, Family, Fantasy",7.3,$85.00M,"Clyde Geronimi, Wilfred Jackson, Hamilton Luske","Ilene Woods, James MacDonald, Eleanor Audley, Verna Felton",,,
2226,2226,superhero movie,2008,PG-13,75 min,"Action, Comedy",4.5,$26.64M,Craig Mazin,"Drake Bell, Leslie Nielsen, Sara Paxton, Christopher McDonald",,,
2227,2227,cinema paradiso,1988,R,155 min,Drama,8.5,$11.99M,Giuseppe Tornatore,"Philippe Noiret, Enzo Cannavale, Antonella Attili, Isa Danieli",,,
2228,2228,coherence,2013,Not Rated,89 min,"Mystery, Sci-Fi, Thriller",7.2,$0.07M,James Ward Byrkit,"Emily Baldoni, Maury Sterling, Nicholas Brendon, Elizabeth Gracen",,,
2229,2229,the iceman,2012,R,106 min,"Biography, Crime, Drama",6.9,$1.94M,Ariel Vromen,"Michael Shannon, Chris Evans, James Franco, Winona Ryder",,,
2230,2230,the clapper,2017,R,89 min,Comedy,5.1,,Dito Montiel,"Amanda Seyfried, Leah Remini, Ed Helms, Alan Thicke",,,
2231,2231,seven pounds,2008,PG-13,123 min,"Drama, Romance",7.6,$69.95M,Gabriele Muccino,"Will Smith, Rosario Dawson, Woody Harrelson, Michael Ealy",,,
2232,2232,a prayer before dawn,2017,R,116 min,"Action, Biography, Crime",7.0,,Jean-Stphane Sauvaire,"Joe Cole, Vithaya Pansringarm, Nicolas Shake, Panya Yimmumphai",,,
2233,2233,fruitvale station,2013,R,85 min,"Biography, Drama, Romance",7.5,$16.10M,Ryan Coogler,"Michael B. Jordan, Melonie Diaz, Octavia Spencer, Kevin Durand",,,
2234,2234,colette,2018,,111 min,"Biography, Drama",7.3,,Wash Westmoreland,"Keira Knightley, Dominic West, Eleanor Tomlinson, Fiona Shaw",,,
2235,2235,the sisterhood of the traveling pants,2005,PG,119 min,"Comedy, Drama, Romance",6.5,$39.01M,Ken Kwapis,"Amber Tamblyn, Alexis Bledel, America Ferrera, Blake Lively",,,
2236,2236,kiss kiss bang bang,2005,R,103 min,"Comedy, Crime, Mystery",7.6,$4.24M,Shane Black,"Robert Downey Jr., Val Kilmer, Michelle Monaghan, Corbin Bernsen",,,
2237,2237,enemy at the gates,2001,R,131 min,"Drama, History, War",7.6,$51.40M,Jean-Jacques Annaud,"Jude Law, Ed Harris, Joseph Fiennes, Rachel Weisz",,,
2238,2238,hall pass,2011,R,105 min,"Comedy, Romance",5.9,$45.06M,"Bobby Farrelly, Peter Farrelly","Owen Wilson, Jason Sudeikis, Christina Applegate, Jenna Fischer",,,
2239,2239,always,1989,PG,122 min,"Fantasy, Romance",6.4,$43.86M,Steven Spielberg,"Richard Dreyfuss, Holly Hunter, Brad Johnson, John Goodman",,,
2240,2240,the rundown,2003,PG-13,104 min,"Action, Adventure, Comedy",6.7,$47.73M,Peter Berg,"Dwayne Johnson, Seann William Scott, Christopher Walken, Rosario Dawson",,,
2241,2241,flipped,2010,PG,90 min,"Comedy, Drama, Romance",7.7,$1.75M,Rob Reiner,"Madeline Carroll, Callan McAuliffe, Rebecca De Mornay, Anthony Edwards",,,
2242,2242,cabin fever,2016,R,99 min,Horror,3.7,,Travis Zariwny,"Gage Golightly, Matthew Daddario, Samuel Davis, Nadine Crocker",,,
2243,2243,the matrix revolutions,2003,R,129 min,"Action, Sci-Fi",6.7,$139.31M,"Lana Wachowski, Lilly Wachowski","Keanu Reeves, Laurence Fishburne, Carrie-Anne Moss, Hugo Weaving",,,
2244,2244,their finest,2016,R,117 min,"Comedy, Drama, Romance",6.8,$3.60M,Lone Scherfig,"Gemma Arterton, Sam Claflin, Bill Nighy, Richard E. Grant",,,
2245,2245,son of the mask,2005,PG,94 min,"Comedy, Family, Fantasy",2.2,$17.02M,Lawrence Guterman,"Jamie Kennedy, Traylor Howard, Alan Cumming, Liam Falconer",,,
2247,2247,blade: trinity,2004,R,113 min,"Action, Adventure, Horror",5.9,$52.41M,David S. Goyer,"Wesley Snipes, Kris Kristofferson, Parker Posey, Ryan Reynolds",,,
2248,2248,the limehouse golem,2016,Not Rated,109 min,"Horror, Mystery, Thriller",6.3,,Juan Carlos Medina,"Douglas Booth, Olivia Cooke, Sam Reid, Mara Valverde",,,
2249,2249,the only living boy in new york,2017,R,89 min,Drama,6.3,$0.62M,Marc Webb,"Callum Turner, Kate Beckinsale, Pierce Brosnan, Cynthia Nixon",,,
2250,2250,nacho libre,2006,PG,92 min,"Comedy, Family, Sport",5.7,$80.20M,Jared Hess,"Jack Black, Ana de la Reguera, Hctor Jimnez, Darius Rose",,,
2251,2251,borat: cultural learnings of america for make benefit glorious nation of kazakhstan,2006,R,84 min,Comedy,7.3,$128.51M,Larry Charles,"Sacha Baron Cohen, Ken Davitian, Luenell, Chester",,,
2252,2252,mr. right,2015,R,95 min,"Action, Comedy, Romance",6.3,$0.03M,Paco Cabezas,"Anna Kendrick, Sam Rockwell, Tim Roth, James Ransone",,,
2253,2253,the neighbor,2018,R,105 min,"Drama, Thriller",4.7,,Aaron Harvey,"William Fichtner, Jessica McNamee, Jean Louisa Kelly, Michael Rosenbaum",,,
2254,2254,domino,2005,R,127 min,"Action, Biography, Crime",6.0,$10.17M,Tony Scott,"Keira Knightley, Mickey Rourke, Edgar Ramrez, Delroy Lindo",,,
2255,2255,brothers,2009,R,105 min,"Drama, Thriller, War",7.1,$28.50M,Jim Sheridan,"Jake Gyllenhaal, Natalie Portman, Tobey Maguire, Sam Shepard",,,
2256,2256,stillwater,2018,,92 min,"Mystery, Thriller",5.2,,Nino Aldi,"Tyler Ritter, Carlena Britch, Eric Michael Roy, Paul Elia",,,
2257,2257,this is spinal tap,1984,R,82 min,"Comedy, Music",8.0,$0.19M,Rob Reiner,"Rob Reiner, Michael McKean, Christopher Guest, Kimberly Stringer",,,
2258,2258,viy 2: journey to china,2018,,,"Adventure, Fantasy",,,Oleg Stepchenko,"Arnold Schwarzenegger, Jackie Chan, Rutger Hauer, Jason Flemyng",,,
2259,2259,layer cake,2004,R,105 min,"Crime, Drama, Thriller",7.4,$2.34M,Matthew Vaughn,"Daniel Craig, Sienna Miller, Michael Gambon, Tom Hardy",,,
2260,2260,when harry met sally...,1989,R,96 min,"Comedy, Drama, Romance",7.6,$92.82M,Rob Reiner,"Billy Crystal, Meg Ryan, Carrie Fisher, Bruno Kirby",,,
2261,2261,metropolis,1927,Not Rated,153 min,"Drama, Sci-Fi",8.3,$0.03M,Fritz Lang,"Brigitte Helm, Alfred Abel, Gustav Frhlich, Rudolf Klein-Rogge",,,
2263,2263,the wicker man,2006,PG-13,102 min,"Horror, Mystery, Thriller",3.7,$23.64M,Neil LaBute,"Nicolas Cage, Ellen Burstyn, Leelee Sobieski, Kate Beahan",,,
2264,2264,death becomes her,1992,PG-13,104 min,"Comedy, Fantasy, Horror",6.5,$58.42M,Robert Zemeckis,"Meryl Streep, Bruce Willis, Goldie Hawn, Isabella Rossellini",,,
2265,2265,death at a funeral,2007,R,90 min,Comedy,7.4,$8.58M,Frank Oz,"Matthew Macfadyen, Peter Dinklage, Ewen Bremner, Keeley Hawes",,,
2266,2266,you're next,2011,R,95 min,"Horror, Thriller",6.5,$18.47M,Adam Wingard,"Sharni Vinson, Joe Swanberg, AJ Bowen, Nicholas Tucci",,,
2267,2267,last action hero,1993,PG-13,130 min,"Action, Adventure, Comedy",6.3,$50.02M,John McTiernan,"Arnold Schwarzenegger, F. Murray Abraham, Art Carney, Charles Dance",,,
2268,2268,colonia,2015,R,106 min,"Drama, Romance, Thriller",7.1,,Florian Gallenberger,"Emma Watson, Daniel Brhl, Michael Nyqvist, Richenda Carey",,,
2269,2269,the hangover part ii,2011,R,102 min,"Comedy, Mystery",6.5,$254.46M,Todd Phillips,"Bradley Cooper, Zach Galifianakis, Ed Helms, Justin Bartha",,,
2270,2270,taare zameen par,2007,PG,165 min,"Drama, Family",8.5,$1.20M,"Aamir Khan, Amole Gupte","Darsheel Safary, Aamir Khan, Tanay Chheda, Sachet Engineer",,,
2271,2271,bonnie and clyde,1967,R,111 min,"Action, Biography, Crime",7.9,,Arthur Penn,"Warren Beatty, Faye Dunaway, Michael J. Pollard, Gene Hackman",,,
2272,2272,that thing you do!,1996,PG,108 min,"Comedy, Drama, Music",6.9,$25.81M,Tom Hanks,"Tom Hanks, Liv Tyler, Charlize Theron, Tom Everett Scott",,,
2273,2273,something's gotta give,2003,PG-13,128 min,"Comedy, Drama, Romance",6.7,$124.73M,Nancy Meyers,"Jack Nicholson, Diane Keaton, Keanu Reeves, Amanda Peet",,,
2274,2274,27 dresses,2008,PG-13,111 min,"Comedy, Romance",6.1,$76.81M,Anne Fletcher,"Katherine Heigl, James Marsden, Malin Akerman, Brian Kerwin",,,
2275,2275,mash,1970,R,116 min,"Comedy, Drama, War",7.6,$81.60M,Robert Altman,"Donald Sutherland, Elliott Gould, Tom Skerritt, Sally Kellerman",,,
2276,2276,bad grandmas,2017,,92 min,"Action, Comedy, Crime",4.4,$0.02M,Srikant Chellappa,"Pam Grier, Judge Reinhold, Florence Henderson, Randall Batinkoff",,,
2277,2277,the change-up,2011,R,112 min,"Comedy, Fantasy",6.3,$37.08M,David Dobkin,"Jason Bateman, Ryan Reynolds, Olivia Wilde, Leslie Mann",,,
2278,2278,machete kills,2013,R,107 min,"Action, Crime, Sci-Fi",5.6,$8.01M,Robert Rodriguez,"Danny Trejo, Alexa PenaVega, Mel Gibson, Jessica Alba",,,
2279,2279,this is where i leave you,2014,R,103 min,"Comedy, Drama",6.6,$34.29M,Shawn Levy,"Jason Bateman, Tina Fey, Jane Fonda, Adam Driver",,,
2280,2280,earth girls are easy,1988,PG,100 min,"Comedy, Musical, Romance",5.3,$3.92M,Julien Temple,"Geena Davis, Jeff Goldblum, Jim Carrey, Damon Wayans",,,
2281,2281,cheaper by the dozen 2,2005,PG,94 min,"Adventure, Comedy, Family",5.5,$82.57M,Adam Shankman,"Steve Martin, Bonnie Hunt, Hilary Duff, Eugene Levy",,,
2282,2282,amityville: the awakening,2017,PG-13,85 min,"Horror, Thriller",4.9,$0.00M,Franck Khalfoun,"Jennifer Jason Leigh, Bella Thorne, Mckenna Grace, Cameron Monaghan",,,
2283,2283,the paperboy,2012,R,107 min,"Crime, Drama, Horror",5.8,$0.69M,Lee Daniels,"Matthew McConaughey, Nicole Kidman, John Cusack, Zac Efron",,,
2284,2284,enter the void,2009,Not Rated,161 min,"Drama, Fantasy",7.3,$0.34M,Gaspar No,"Nathaniel Brown, Paz de la Huerta, Cyril Roy, Olly Alexander",,,
2285,2285,caf society,2016,PG-13,96 min,"Comedy, Drama, Romance",6.6,$11.10M,Woody Allen,"Jesse Eisenberg, Kristen Stewart, Steve Carell, Blake Lively",,,
2286,2286,save the last dance,2001,PG-13,112 min,"Drama, Music, Romance",6.2,$91.06M,Thomas Carter,"Julia Stiles, Sean Patrick Thomas, Kerry Washington, Fredro Starr",,,
2287,2287,dogville,2003,R,178 min,"Crime, Drama",8.0,$1.53M,Lars von Trier,"Nicole Kidman, Paul Bettany, Lauren Bacall, Harriet Andersson",,,
2288,2288,falling down,1993,R,113 min,"Crime, Drama, Thriller",7.6,$40.90M,Joel Schumacher,"Michael Douglas, Robert Duvall, Barbara Hershey, Rachel Ticotin",,,
2289,2289,tusk,2014,R,102 min,"Comedy, Drama, Horror",5.4,$1.82M,Kevin Smith,"Justin Long, Michael Parks, Haley Joel Osment, Genesis Rodriguez",,,
2290,2290,escape from l.a.,1996,R,101 min,"Action, Adventure, Sci-Fi",5.7,$25.48M,John Carpenter,"Kurt Russell, Steve Buscemi, Stacy Keach, Peter Fonda",,,
2291,2291,hope floats,1998,PG-13,114 min,"Drama, Romance",5.9,$60.05M,Forest Whitaker,"Sandra Bullock, Harry Connick Jr., Gena Rowlands, Mae Whitman",,,
2292,2292,bridget jones's baby,2016,R,118 min,"Comedy, Romance",6.6,$24.25M,Sharon Maguire,"Rene Zellweger, Gemma Jones, Jim Broadbent, Sally Phillips",,,
2293,2293,endless love,2014,PG-13,104 min,"Drama, Romance",6.3,$23.39M,Shana Feste,"Gabriella Wilde, Alex Pettyfer, Bruce Greenwood, Robert Patrick",,,
2294,2294,slumber,2017,R,84 min,Horror,4.7,,Jonathan Hopkins,"Maggie Q, Will Kemp, Sylvester McCoy, Sam Troughton",,,
2295,2295,flatliners,1990,R,115 min,"Drama, Horror, Sci-Fi",6.6,$61.49M,Joel Schumacher,"Kiefer Sutherland, Kevin Bacon, Julia Roberts, William Baldwin",,,
2296,2296,deep impact,1998,PG-13,120 min,"Action, Drama, Romance",6.1,$140.46M,Mimi Leder,"Robert Duvall, Ta Leoni, Elijah Wood, Morgan Freeman",,,
2297,2297,lie with me,2005,Not Rated,93 min,"Drama, Romance",5.4,,Clement Virgo,"Lauren Lee Smith, Eric Balfour, Polly Shannon, Mayko Nguyen",,,
2298,2298,killer elite,2011,R,116 min,"Action, Crime, History",6.5,$25.12M,Gary McKendry,"Jason Statham, Clive Owen, Robert De Niro, Dominic Purcell",,,
2299,2299,the assassination of jesse james by the coward robert ford,2007,R,160 min,"Biography, Crime, Drama",7.5,$3.90M,Andrew Dominik,"Brad Pitt, Casey Affleck, Sam Shepard, Mary-Louise Parker",,,
2300,2300,saturday night fever,1977,R,118 min,"Drama, Music",6.8,$94.21M,John Badham,"John Travolta, Karen Lynn Gorney, Barry Miller, Joseph Cali",,,
2301,2301,the descent: part 2,2009,R,94 min,"Adventure, Horror, Thriller",5.8,,Jon Harris,"Michael J. Reynolds, Shauna Macdonald, Jessika Williams, Douglas Hodge",,,
2302,2302,blade ii,2002,R,117 min,"Action, Horror, Sci-Fi",6.7,$82.35M,Guillermo del Toro,"Wesley Snipes, Kris Kristofferson, Ron Perlman, Leonor Varela",,,
2303,2303,beasts of no nation,2015,Not Rated,137 min,"Drama, War",7.8,$0.08M,Cary Joji Fukunaga,"Abraham Attah, Emmanuel Affadzi, Ricky Adelayitor, Andrew Adote",,,
2304,2304,the adventures of buckaroo banzai across the 8th dimension,1984,PG,103 min,"Adventure, Comedy, Romance",6.4,$6.25M,W.D. Richter,"Peter Weller, John Lithgow, Ellen Barkin, Jeff Goldblum",,,
2305,2305,the last starfighter,1984,PG,101 min,"Action, Adventure, Sci-Fi",6.7,$28.73M,Nick Castle,"Lance Guest, Robert Preston, Kay E. Kuter, Dan Mason",,,
2306,2306,mclintock!,1963,Approved,127 min,"Comedy, Romance, Western",7.3,,Andrew V. McLaglen,"John Wayne, Maureen O'Hara, Patrick Wayne, Stefanie Powers",,,
2307,2307,blonde sinner,1956,Not Rated,99 min,Drama,7.2,,J. Lee Thompson,"Diana Dors, Yvonne Mitchell, Michael Craig, Marie Ney",,,
2308,2308,the number 23,2007,R,98 min,"Mystery, Thriller",6.4,$35.19M,Joel Schumacher,"Jim Carrey, Virginia Madsen, Logan Lerman, Danny Huston",,,
2309,2309,collide,2016,PG-13,99 min,"Action, Crime, Thriller",5.7,$2.28M,Eran Creevy,"Nicholas Hoult, Felicity Jones, Anthony Hopkins, Ben Kingsley",,,
2310,2310,picture of beauty,2017,,70 min,"Drama, Romance",3.8,,Maxim Ford,"Taylor Sands, Danielle Rose, Pawel Hajnos, Magdalena Bochan-Jachimek",,,
2311,2311,first they killed my father,2017,TV-MA,136 min,"Biography, Drama, History",7.2,,Angelina Jolie,"Sareum Srey Moch, Phoeung Kompheak, Sveng Socheata, Mun Kimhak",,,
2312,2312,treasure planet,2002,PG,95 min,"Animation, Adventure, Family",7.1,$38.18M,"Ron Clements, John Musker","Joseph Gordon-Levitt, Emma Thompson, Martin Short, Roscoe Lee Browne",,,
2313,2313,self/less,2015,PG-13,117 min,"Action, Mystery, Sci-Fi",6.5,$12.28M,Tarsem Singh,"Ryan Reynolds, Natalie Martinez, Matthew Goode, Ben Kingsley",,,
2314,2314,practical magic,1998,PG-13,104 min,"Comedy, Drama, Fantasy",6.2,$46.68M,Griffin Dunne,"Sandra Bullock, Nicole Kidman, Stockard Channing, Dianne Wiest",,,
2315,2315,the land before time,1988,G,69 min,"Animation, Adventure, Drama",7.4,$48.09M,Don Bluth,"Pat Hingle, Gabriel Damon, Judith Barsi, Helen Shaver",,,
2316,2316,valkyrie,2008,PG-13,121 min,"Drama, History, Thriller",7.1,$83.08M,Bryan Singer,"Tom Cruise, Bill Nighy, Carice van Houten, Kenneth Branagh",,,
2317,2317,draft day,2014,PG-13,110 min,"Drama, Sport",6.8,$28.83M,Ivan Reitman,"Kevin Costner, Chadwick Boseman, Jennifer Garner, Frank Langella",,,
2318,2318,amar,2017,,105 min,"Drama, Romance, Thriller",5.2,,Esteban Crespo,"Mara Pedraza, Pol Monen, Natalia Tena, Greta Fernndez",,,
2319,2319,the mechanic,2011,R,93 min,"Action, Crime, Thriller",6.6,$29.12M,Simon West,"Jason Statham, Ben Foster, Donald Sutherland, Tony Goldwyn",,,
2320,2320,being john malkovich,1999,R,112 min,"Comedy, Drama, Fantasy",7.8,$22.86M,Spike Jonze,"John Cusack, Cameron Diaz, Catherine Keener, John Malkovich",,,
2321,2321,jeepers creepers ii,2003,R,104 min,Horror,5.6,$35.67M,Victor Salva,"Jonathan Breck, Ray Wise, Nicki Aycox, Garikayi Mutambirwa",,,
2322,2322,commando,1985,R,90 min,"Action, Adventure, Thriller",6.7,$35.10M,Mark L. Lester,"Arnold Schwarzenegger, Rae Dawn Chong, Dan Hedaya, Vernon Wells",,,
2323,2323,eye in the sky,2015,R,102 min,"Drama, Thriller, War",7.3,$18.70M,Gavin Hood,"Helen Mirren, Aaron Paul, Alan Rickman, Barkhad Abdi",,,
2324,2324,final destination 5,2011,R,92 min,"Fantasy, Horror, Mystery",5.9,$42.59M,Steven Quale,"Nicholas D'Agosto, Emma Bell, Arlen Escarpeta, Miles Fisher",,,
2325,2325,testament of youth,2014,PG-13,129 min,"Biography, Drama, History",7.3,$1.82M,James Kent,"Alicia Vikander, Kit Harington, Taron Egerton, Dominic West",,,
2326,2326,the other boleyn girl,2008,PG-13,115 min,"Biography, Drama, History",6.7,$26.81M,Justin Chadwick,"Natalie Portman, Scarlett Johansson, Eric Bana, Jim Sturgess",,,
2327,2327,pitch black,2000,R,109 min,"Horror, Sci-Fi",7.1,$39.24M,David Twohy,"Radha Mitchell, Cole Hauser, Vin Diesel, Keith David",,,
2328,2328,the son of bigfoot,2017,PG,92 min,"Animation, Comedy, Family",6.2,,"Jeremy Degruson, Ben Stassen","Cinda Adams, Mari Devon, Kirk Thornton, John Allsopp",,,
2329,2329,across the universe,2007,PG-13,133 min,"Drama, Fantasy, Musical",7.4,$24.34M,Julie Taymor,"Evan Rachel Wood, Jim Sturgess, Joe Anderson, Dana Fuchs",,,
2330,2330,into the blue,2005,PG-13,110 min,"Action, Adventure, Crime",5.8,$18.47M,John Stockwell,"Paul Walker, Jessica Alba, Scott Caan, Ashley Scott",,,
2331,2331,jack ryan: shadow recruit,2014,PG-13,105 min,"Action, Drama, Thriller",6.2,$50.58M,Kenneth Branagh,"Chris Pine, Kevin Costner, Keira Knightley, Kenneth Branagh",,,
2332,2332,a view to a kill,1985,PG,131 min,"Action, Adventure, Thriller",6.3,$50.33M,John Glen,"Roger Moore, Christopher Walken, Tanya Roberts, Grace Jones",,,
2333,2333,last knights,2015,R,115 min,"Action, Adventure",6.2,,Kazuaki Kiriya,"Clive Owen, Morgan Freeman, Aksel Hennie, Payman Maadi",,,
2334,2334,bolt,2008,PG,96 min,"Animation, Adventure, Comedy",6.9,$114.05M,"Byron Howard, Chris Williams","John Travolta, Miley Cyrus, Susie Essman, Mark Walton",,,
2335,2335,network,1976,R,121 min,Drama,8.1,,Sidney Lumet,"Faye Dunaway, William Holden, Peter Finch, Robert Duvall",,,
2336,2336,high-rise,2015,R,119 min,Drama,5.6,$0.34M,Ben Wheatley,"Tom Hiddleston, Jeremy Irons, Sienna Miller, Luke Evans",,,
2337,2337,lost highway,1997,R,134 min,"Mystery, Thriller",7.6,$3.80M,David Lynch,"Bill Pullman, Patricia Arquette, John Roselius, Louis Eppolito",,,
2338,2338,101 dalmatians,1996,G,103 min,"Adventure, Comedy, Crime",5.7,$136.19M,Stephen Herek,"Glenn Close, Jeff Daniels, Joely Richardson, Joan Plowright",,,
2339,2339,young guns,1988,R,107 min,"Action, Crime, Drama",6.8,$45.66M,Christopher Cain,"Emilio Estevez, Kiefer Sutherland, Lou Diamond Phillips, Charlie Sheen",,,
2340,2340,the midnight man,2016,,95 min,Horror,4.9,,Travis Zariwny,"Logan Creran, Robert Englund, Grayson Gabriel, Emily Haine",,,
2341,2341,cloudy with a chance of meatballs,2009,PG,90 min,"Animation, Action, Adventure",7.0,$124.87M,"Phil Lord, Christopher Miller","Anna Faris, Bill Hader, Bruce Campbell, James Caan",,,
2342,2342,romeo and juliet,1968,PG,138 min,"Drama, Romance",7.6,$38.90M,Franco Zeffirelli,"Leonard Whiting, Olivia Hussey, John McEnery, Milo O'Shea",,,
2343,2343,con man,2018,Not Rated,100 min,Drama,4.8,,Bruce Caulk,"Armand Assante, Carlos Ayala, Justin Baldoni, Shanna Beauchamp",,,
2344,2344,the crazies,2010,R,101 min,"Horror, Thriller",6.5,$39.12M,Breck Eisner,"Radha Mitchell, Timothy Olyphant, Danielle Panabaker, Joe Anderson",,,
2345,2345,home alone 2: lost in new york,1992,PG,120 min,"Adventure, Comedy, Family",6.6,$173.59M,Chris Columbus,"Macaulay Culkin, Joe Pesci, Daniel Stern, Catherine O'Hara",,,
2346,2346,desperado,1995,R,104 min,"Action, Thriller",7.2,$25.63M,Robert Rodriguez,"Antonio Banderas, Salma Hayek, Joaquim de Almeida, Cheech Marin",,,
2347,2347,white men can't jump,1992,R,115 min,"Comedy, Drama, Sport",6.7,$76.25M,Ron Shelton,"Wesley Snipes, Woody Harrelson, Rosie Perez, Tyra Ferrell",,,
2348,2348,misconduct,2016,R,106 min,"Crime, Drama, Mystery",5.3,,Shintaro Shimosawa,"Josh Duhamel, Anthony Hopkins, Al Pacino, Alice Eve",,,
2349,2349,the skeleton twins,2014,R,93 min,"Comedy, Drama, Romance",6.8,$5.28M,Craig Johnson,"Kristen Wiig, Bill Hader, Luke Wilson, Ty Burrell",,,
2350,2350,a dangerous method,2011,R,99 min,"Biography, Drama, Romance",6.5,$5.70M,David Cronenberg,"Michael Fassbender, Keira Knightley, Viggo Mortensen, Vincent Cassel",,,
2351,2351,gandhi,1982,PG,191 min,"Biography, Drama, History",8.1,$52.77M,Richard Attenborough,"Ben Kingsley, John Gielgud, Candice Bergen, Edward Fox",,,
2352,2352,memoirs of a geisha,2005,PG-13,145 min,"Drama, Romance",7.4,$57.49M,Rob Marshall,"Ziyi Zhang, Ken Watanabe, Michelle Yeoh, Suzuka Ohgo",,,
2353,2353,colombiana,2011,PG-13,108 min,"Action, Crime, Drama",6.4,$36.67M,Olivier Megaton,"Zoe Saldana, Michael Vartan, Callum Blue, Jordi Moll",,,
2354,2354,otherlife,2017,,96 min,"Crime, Mystery, Sci-Fi",6.3,,Ben C. Lucas,"Jessica De Gouw, Thomas Cocquerel, T.J. Power, Shalom Brune-Franklin",,,
2356,2356,attack the block,2011,R,88 min,"Action, Comedy, Sci-Fi",6.6,$1.02M,Joe Cornish,"John Boyega, Jodie Whittaker, Alex Esmail, Leeon Jones",,,
2357,2357,isn't it romantic,2019,,,Comedy,,,Todd Strauss-Schulson,"Adam Devine, Priyanka Chopra, Liam Hemsworth, Rebel Wilson",,,
2358,2358,sky high,2005,PG,100 min,"Adventure, Comedy, Family",6.2,$63.95M,Mike Mitchell,"Kurt Russell, Kelly Preston, Michael Angarano, Danielle Panabaker",,,
2360,2360,only lovers left alive,2013,R,123 min,"Comedy, Drama, Fantasy",7.3,$1.88M,Jim Jarmusch,"Tilda Swinton, Tom Hiddleston, Mia Wasikowska, John Hurt",,,
2361,2361,paper towns,2015,PG-13,109 min,"Drama, Mystery, Romance",6.3,$32.00M,Jake Schreier,"Nat Wolff, Cara Delevingne, Austin Abrams, Justice Smith",,,
2362,2362,entourage,2015,R,104 min,Comedy,6.6,$32.36M,Doug Ellin,"Adrian Grenier, Kevin Connolly, Jerry Ferrara, Kevin Dillon",,,
2363,2363,chocolat,2000,PG-13,121 min,"Drama, Romance",7.3,$71.51M,Lasse Hallstrm,"Juliette Binoche, Judi Dench, Alfred Molina, Carrie-Anne Moss",,,
2364,2364,dear john,2010,PG-13,108 min,"Drama, Romance, War",6.3,$80.01M,Lasse Hallstrm,"Channing Tatum, Amanda Seyfried, Richard Jenkins, Henry Thomas",,,
2365,2365,gemini man,2019,,,"Action, Drama, Sci-Fi",,,Ang Lee,"Mary Elizabeth Winstead, Will Smith, Clive Owen, Benedict Wong",,,
