,movie_no,movie_name,movie_year,movie_certificate,movie_runtime,movie_genre,movie_score,movie_gross,movie_director,movie_star,movie_writer,tomatoter,audience
1349,1349,soul surfer,2011,PG,112 min,"Biography, Drama, Family",7.1,$43.85M,Sean McNamara,"AnnaSophia Robb, Dennis Quaid, Helen Hunt, Carrie Underwood",,,
1350,1350,legion,2010,R,100 min,"Action, Fantasy, Horror",5.2,$40.17M,Scott Stewart,"Paul Bettany, Dennis Quaid, Charles S. Dutton, Lucas Black",,,
1351,1351,shrek 2,2004,PG,93 min,"Animation, Adventure, Comedy",7.2,$436.47M,"Andrew Adamson, Kelly Asbury, Conrad Vernon","Mike Myers, Eddie Murphy, Cameron Diaz, Julie Andrews",,,
1352,1352,ocean's twelve,2004,PG-13,125 min,"Crime, Thriller",6.5,$125.54M,Steven Soderbergh,"George Clooney, Brad Pitt, Julia Roberts, Catherine Zeta-Jones",,,
1353,1353,prince of persia: the sands of time,2010,PG-13,116 min,"Action, Adventure, Fantasy",6.6,$90.76M,Mike Newell,"Jake Gyllenhaal, Gemma Arterton, Ben Kingsley, Alfred Molina",,,
1354,1354,fences,2016,PG-13,139 min,Drama,7.2,$57.64M,Denzel Washington,"Denzel Washington, Viola Davis, Stephen Henderson, Jovan Adepo",,,
1355,1355,enchanted,2007,PG,107 min,"Animation, Comedy, Family",7.1,$127.81M,Kevin Lima,"Amy Adams, Susan Sarandon, James Marsden, Patrick Dempsey",,,
1356,1356,the imaginarium of doctor parnassus,2009,PG-13,123 min,"Adventure, Fantasy, Mystery",6.8,$7.69M,Terry Gilliam,"Christopher Plummer, Lily Cole, Heath Ledger, Andrew Garfield",,,
1357,1357,the way back,2010,PG-13,133 min,"Adventure, Drama, History",7.3,$2.70M,Peter Weir,"Jim Sturgess, Ed Harris, Colin Farrell, Dragos Bucur",,,
1358,1358,thank you for your service,2017,R,109 min,"Biography, Drama, War",6.5,$9.47M,Jason Hall,"Miles Teller, Beulah Koale, Joe Cole, Scott Haze",,,
1359,1359,the man in the iron mask,1998,PG-13,132 min,"Action, Adventure",6.5,$56.97M,Randall Wallace,"Leonardo DiCaprio, Jeremy Irons, John Malkovich, Grard Depardieu",,,
1360,1360,the karate kid,2010,PG,140 min,"Action, Drama, Family",6.2,$176.59M,Harald Zwart,"Jackie Chan, Jaden Smith, Taraji P. Henson, Wenwen Han",,,
1361,1361,g.i. joe: the rise of cobra,2009,PG-13,118 min,"Action, Adventure, Sci-Fi",5.8,$152.27M,Stephen Sommers,"Dennis Quaid, Channing Tatum, Marlon Wayans, Adewale Akinnuoye-Agbaje",,,
1362,1362,click,2006,PG-13,107 min,"Comedy, Drama, Fantasy",6.4,$137.36M,Frank Coraci,"Adam Sandler, Kate Beckinsale, Christopher Walken, David Hasselhoff",,,
1363,1363,"definitely, maybe",2008,PG-13,112 min,"Comedy, Drama, Romance",7.2,$31.97M,Adam Brooks,"Ryan Reynolds, Rachel Weisz, Abigail Breslin, An Nguyen",,,
1364,1364,shame,2011,NC-17,101 min,Drama,7.2,$4.00M,Steve McQueen,"Michael Fassbender, Carey Mulligan, James Badge Dale, Lucy Walters",,,
1365,1365,aftermath,2017,R,94 min,"Drama, Thriller",5.7,,Elliott Lester,"Arnold Schwarzenegger, Scoot McNairy, Maggie Grace, Judah Nelson",,,
1366,1366,flight,2012,R,138 min,"Drama, Thriller",7.3,$93.77M,Robert Zemeckis,"Denzel Washington, Nadine Velazquez, Don Cheadle, John Goodman",,,
1367,1367,panic room,2002,R,112 min,"Crime, Drama, Thriller",6.8,$96.40M,David Fincher,"Jodie Foster, Kristen Stewart, Forest Whitaker, Dwight Yoakam",,,
1368,1368,on body and soul,2017,Not Rated,116 min,"Drama, Romance",7.7,,Ildik Enyedi,"Gza Morcsnyi, Alexandra Borbly, Zoltn Schneider, Ervin Nagy",,,
1369,1369,midnight special,2016,PG-13,112 min,"Drama, Mystery, Sci-Fi",6.6,$3.71M,Jeff Nichols,"Michael Shannon, Joel Edgerton, Kirsten Dunst, Adam Driver",,,
1370,1370,office christmas party,2016,R,105 min,Comedy,5.8,$54.73M,"Josh Gordon, Will Speck","Jason Bateman, Olivia Munn, T.J. Miller, Jennifer Aniston",,,
1371,1371,mama,2013,PG-13,100 min,"Horror, Thriller",6.2,$71.63M,Andy Muschietti,"Jessica Chastain, Nikolaj Coster-Waldau, Megan Charpentier, Isabelle Nlisse",,,
1372,1372,busanhaeng,2016,TV-MA,118 min,"Action, Horror, Thriller",7.5,$2.13M,Sang-ho Yeon,"Yoo Gong, Yu-mi Jung, Dong-seok Ma, Su-an Kim",,,
1373,1373,suite franaise,2014,,107 min,"Drama, Romance, War",6.9,,Saul Dibb,"Michelle Williams, Kristin Scott Thomas, Margot Robbie, Eric Godon",,,
1374,1374,paul,2011,R,104 min,"Adventure, Comedy, Sci-Fi",7.0,$37.41M,Greg Mottola,"Simon Pegg, Nick Frost, Seth Rogen, Mia Stallard",,,
1375,1375,munich,2005,R,164 min,"Drama, History, Thriller",7.6,$47.40M,Steven Spielberg,"Eric Bana, Daniel Craig, Marie-Jose Croze, Ciarn Hinds",,,
1376,1376,cape fear,1991,R,128 min,"Crime, Thriller",7.3,$79.10M,Martin Scorsese,"Robert De Niro, Nick Nolte, Jessica Lange, Juliette Lewis",,,
1377,1377,eighth grade,2018,,94 min,Comedy,7.3,,Bo Burnham,"Elsie Fisher, Josh Hamilton, Emily Robinson, Missy Yager",,,
1378,1378,the terminal,2004,PG-13,128 min,"Comedy, Drama, Romance",7.3,$77.87M,Steven Spielberg,"Tom Hanks, Catherine Zeta-Jones, Chi McBride, Stanley Tucci",,,
1379,1379,to the bone,2017,TV-MA,107 min,Drama,6.9,,Marti Noxon,"Rebekah Kennedy, Lily Collins, Dana L. Wilson, Ziah Colon",,,
1380,1380,austin powers: the spy who shagged me,1999,PG-13,95 min,"Action, Adventure, Comedy",6.6,$206.04M,Jay Roach,"Mike Myers, Heather Graham, Michael York, Robert Wagner",,,
1381,1381,the master,2012,R,138 min,Drama,7.1,$16.38M,Paul Thomas Anderson,"Philip Seymour Hoffman, Joaquin Phoenix, Amy Adams, Jesse Plemons",,,
1382,1382,jack reacher,2012,PG-13,130 min,"Action, Crime, Mystery",7.0,$80.07M,Christopher McQuarrie,"Tom Cruise, Rosamund Pike, Richard Jenkins, Werner Herzog",,,
1383,1383,the man who invented christmas,2017,PG,104 min,"Biography, Comedy, Drama",7.0,$5.68M,Bharat Nalluri,"Dan Stevens, Mark Schrier, Patrick Joseph Byrnes, Miriam Margolyes",,,
1384,1384,everybody wants some!!,2016,R,117 min,Comedy,7.0,$3.37M,Richard Linklater,"Blake Jenner, Tyler Hoechlin, Ryan Guzman, Zoey Deutch",,,
1385,1385,no escape,2015,R,103 min,"Action, Thriller",6.8,$27.29M,John Erick Dowdle,"Lake Bell, Pierce Brosnan, Owen Wilson, Thanawut Ketsaro",,,
1386,1386,free fire,2016,R,91 min,"Action, Comedy, Crime",6.4,$1.80M,Ben Wheatley,"Sharlto Copley, Brie Larson, Armie Hammer, Cillian Murphy",,,
1387,1387,y tu mam tambin,2001,R,106 min,"Adventure, Comedy, Drama",7.7,$13.62M,Alfonso Cuarn,"Maribel Verd, Gael Garca Bernal, Daniel Gimnez Cacho, Ana Lpez Mercado",,,
1388,1388,"honey, i shrunk the kids",1989,PG,93 min,"Adventure, Comedy, Family",6.3,$130.72M,Joe Johnston,"Rick Moranis, Matt Frewer, Marcia Strassman, Kristine Sutherland",,,
1389,1389,2 guns,2013,R,109 min,"Action, Comedy, Crime",6.7,$75.61M,Baltasar Kormkur,"Denzel Washington, Mark Wahlberg, Paula Patton, Bill Paxton",,,
1390,1390,alice through the looking glass,2016,PG,113 min,"Adventure, Family, Fantasy",6.2,$77.04M,James Bobin,"Mia Wasikowska, Johnny Depp, Helena Bonham Carter, Anne Hathaway",,,
1391,1391,rear window,1954,PG,112 min,"Mystery, Thriller",8.5,$36.76M,Alfred Hitchcock,"James Stewart, Grace Kelly, Wendell Corey, Thelma Ritter",,,
1393,1393,signs,2002,PG-13,106 min,"Drama, Mystery, Sci-Fi",6.7,$227.97M,M. Night Shyamalan,"Mel Gibson, Joaquin Phoenix, Rory Culkin, Abigail Breslin",,,
1394,1394,misery,1990,R,107 min,"Crime, Drama, Thriller",7.8,$61.28M,Rob Reiner,"James Caan, Kathy Bates, Richard Farnsworth, Frances Sternhagen",,,
1395,1395,the brothers grimm,2005,PG-13,118 min,"Adventure, Comedy, Fantasy",5.9,$37.92M,Terry Gilliam,"Matt Damon, Heath Ledger, Monica Bellucci, Petr Ratimec",,,
1396,1396,kickboxer: retaliation,2018,R,110 min,"Action, Drama",5.0,$0.00M,Dimitri Logothetis,"Alain Moussi, Christopher Lambert, Jean-Claude Van Damme, Mike Tyson",,,
1397,1397,transformers: revenge of the fallen,2009,PG-13,150 min,"Action, Adventure, Sci-Fi",6.0,$402.11M,Michael Bay,"Shia LaBeouf, Megan Fox, Josh Duhamel, Tyrese Gibson",,,
1398,1398,x2,2003,PG-13,134 min,"Action, Adventure, Fantasy",7.5,$214.95M,Bryan Singer,"Patrick Stewart, Hugh Jackman, Halle Berry, Ian McKellen",,,
1399,1399,daredevil,2003,PG-13,103 min,"Action, Crime, Sci-Fi",5.3,$102.54M,Mark Steven Johnson,"Ben Affleck, Jennifer Garner, Colin Farrell, Michael Clarke Duncan",,,
1400,1400,dodgeball: a true underdog story,2004,PG-13,92 min,"Comedy, Sport",6.7,$114.33M,Rawson Marshall Thurber,"Ben Stiller, Christine Taylor, Vince Vaughn, Rip Torn",,,
1402,1402,fist fight,2017,R,91 min,Comedy,5.6,$32.19M,Richie Keen,"Ice Cube, Charlie Day, Tracy Morgan, Christina Hendricks",,,
1403,1403,the expendables,2010,R,103 min,"Action, Adventure, Thriller",6.5,$103.07M,Sylvester Stallone,"Sylvester Stallone, Jason Statham, Jet Li, Dolph Lundgren",,,
1404,1404,wagon master,1950,Approved,86 min,"Adventure, Western",7.2,,John Ford,"Ben Johnson, Joanne Dru, Harry Carey Jr., Ward Bond",,,
1405,1405,friday,1995,R,91 min,"Comedy, Drama",7.3,$27.47M,F. Gary Gray,"Ice Cube, Chris Tucker, Nia Long, Tommy 'Tiny' Lister",,,
1406,1406,how to train your dragon 3,2019,,,"Animation, Action, Adventure",,,Dean DeBlois,"Cate Blanchett, T.J. Miller, Kristen Wiig, Gerard Butler",,,
1407,1407,the kings of summer,2013,R,95 min,"Adventure, Comedy, Drama",7.2,$1.29M,Jordan Vogt-Roberts,"Nick Robinson, Gabriel Basso, Moises Arias, Nick Offerman",,,
1408,1408,the pursuit of happyness,2006,PG-13,117 min,"Biography, Drama",8.0,$163.57M,Gabriele Muccino,"Will Smith, Thandie Newton, Jaden Smith, Brian Howe",,,
1409,1409,the village,2004,PG-13,108 min,"Drama, Mystery, Thriller",6.5,$114.20M,M. Night Shyamalan,"Sigourney Weaver, William Hurt, Joaquin Phoenix, Bryce Dallas Howard",,,
1410,1410,life of brian,1979,R,94 min,Comedy,8.1,$20.05M,Terry Jones,"Graham Chapman, John Cleese, Michael Palin, Terry Gilliam",,,
1411,1411,horrible bosses,2011,R,98 min,"Comedy, Crime",6.9,$117.54M,Seth Gordon,"Jason Bateman, Charlie Day, Jason Sudeikis, Steve Wiebe",,,
1412,1412,a league of their own,1992,PG,128 min,"Comedy, Drama, Family",7.2,$107.53M,Penny Marshall,"Tom Hanks, Geena Davis, Lori Petty, Madonna",,,
1413,1413,mission: impossible,1996,PG-13,110 min,"Action, Adventure, Thriller",7.1,$180.98M,Brian De Palma,"Tom Cruise, Jon Voight, Emmanuelle Bart, Henry Czerny",,,
1414,1414,con air,1997,R,115 min,"Action, Crime, Thriller",6.8,$101.12M,Simon West,"Nicolas Cage, John Cusack, John Malkovich, Colm Meaney",,,
1415,1415,personal shopper,2016,R,105 min,"Drama, Horror, Mystery",6.2,$1.31M,Olivier Assayas,"Kristen Stewart, Lars Eidinger, Sigrid Bouaziz, Anders Danielsen Lie",,,
1416,1416,gattaca,1997,PG-13,106 min,"Drama, Sci-Fi, Thriller",7.8,$12.34M,Andrew Niccol,"Ethan Hawke, Uma Thurman, Jude Law, Gore Vidal",,,
1417,1417,the boy in the striped pajamas,2008,PG-13,94 min,"Drama, War",7.8,$9.03M,Mark Herman,"Asa Butterfield, David Thewlis, Rupert Friend, Zac Mattoon O'Brien",,,
1418,1418,outside in,2017,,109 min,Drama,5.9,$0.01M,Lynn Shelton,"Edie Falco, Jay Duplass, Kaitlyn Dever, Ben Schwartz",,,
1419,1419,princess mononoke,1997,PG-13,134 min,"Animation, Adventure, Fantasy",8.4,$2.38M,Hayao Miyazaki,"Yji Matsuda, Yuriko Ishida, Yko Tanaka, Billy Crudup",,,
1420,1420,pineapple express,2008,R,111 min,"Action, Comedy, Crime",7.0,$87.34M,David Gordon Green,"Seth Rogen, James Franco, Gary Cole, Danny McBride",,,
1421,1421,17 again,2009,PG-13,102 min,"Comedy, Drama, Fantasy",6.4,$64.17M,Burr Steers,"Zac Efron, Matthew Perry, Leslie Mann, Thomas Lennon",,,
1422,1422,edward scissorhands,1990,PG-13,105 min,"Drama, Fantasy, Romance",7.9,$56.36M,Tim Burton,"Johnny Depp, Winona Ryder, Dianne Wiest, Anthony Michael Hall",,,
1423,1423,uncle drew,2018,,,Comedy,,,Charles Stone III,"Tiffany Haddish, Nick Kroll, Shaquille O'Neal, LilRel Howery",,,
1424,1424,death wish,1974,R,93 min,"Action, Crime, Drama",7.0,$22.00M,Michael Winner,"Charles Bronson, Hope Lange, Vincent Gardenia, Steven Keats",,,
1425,1425,movie 43,2013,R,94 min,"Comedy, Romance",4.3,$8.83M,"Elizabeth Banks, Steven Brill, Steve Carr, Rusty Cundieff, James Duffy, Griffin Dunne, Peter Farrelly, Patrik Forsberg, Will Graham, James Gunn, Brett Ratner, Jonathan van Tulleken, Bob Odenkirk","Emma Stone, Stephen Merchant, Richard Gere, Liev Schreiber",,,
1426,1426,johnny english strikes again,2018,,,"Action, Adventure, Comedy",,,David Kerr,"Olga Kurylenko, Emma Thompson, Rowan Atkinson, Jake Lacy",,,
1427,1427,allure,2017,,105 min,"Drama, Romance, Thriller",4.6,,"Carlos Sanchez, Jason Sanchez","Evan Rachel Wood, Julia Sarah Stone, Denis O'Hare, Maxim Roy",,,
1428,1428,don verdean,2015,PG-13,90 min,"Adventure, Comedy, Drama",5.4,,Jared Hess,"Sam Rockwell, Amy Ryan, Jemaine Clement, Danny McBride",,,
1429,1429,the spectacular now,2013,R,95 min,"Comedy, Drama, Romance",7.1,$6.85M,James Ponsoldt,"Miles Teller, Shailene Woodley, Kyle Chandler, Jennifer Jason Leigh",,,
1430,1430,lawrence of arabia,1962,PG,216 min,"Adventure, Biography, Drama",8.3,$44.82M,David Lean,"Peter O'Toole, Alec Guinness, Anthony Quinn, Jack Hawkins",,,
1431,1431,joy,2015,PG-13,124 min,Drama,6.6,$56.45M,David O. Russell,"Jennifer Lawrence, Robert De Niro, Bradley Cooper, Edgar Ramrez",,,
1432,1432,in search of the castaways,1962,Approved,98 min,"Adventure, Family, Fantasy",6.7,$21.75M,Robert Stevenson,"Hayley Mills, Maurice Chevalier, George Sanders, Wilfrid Hyde-White",,,
1433,1433,gamer,2009,R,95 min,"Action, Sci-Fi, Thriller",5.8,$20.49M,"Mark Neveldine, Brian Taylor","Gerard Butler, Michael C. Hall, Ludacris, Amber Valletta",,,
1434,1434,eat locals,2017,,94 min,"Action, Comedy, Horror",5.2,,Jason Flemyng,"Charlie Cox, Mackenzie Crook, Eve Myles, Vincent Regan",,,
1435,1435,irreplaceable you,2018,,96 min,"Comedy, Drama, Romance",6.3,,Stephanie Laing,"Gugu Mbatha-Raw, Michiel Huisman, Steve Coogan, Timothy Simons",,,
1436,1436,holmes and watson,2018,,,"Adventure, Comedy, Mystery",,,Etan Cohen,"Will Ferrell, John C. Reilly, Ralph Fiennes, Rebecca Hall",,,
1437,1437,vertigo,1958,PG,128 min,"Mystery, Romance, Thriller",8.4,$3.20M,Alfred Hitchcock,"James Stewart, Kim Novak, Barbara Bel Geddes, Tom Helmore",,,
1438,1438,cold mountain,2003,R,154 min,"Adventure, Drama, History",7.2,$95.64M,Anthony Minghella,"Jude Law, Nicole Kidman, Rene Zellweger, Eileen Atkins",,,
1439,1439,zathura: a space adventure,2005,PG,101 min,"Action, Adventure, Comedy",6.2,$29.26M,Jon Favreau,"Josh Hutcherson, Jonah Bobo, Dax Shepard, Tim Robbins",,,
1440,1440,logan's run,1976,PG,119 min,"Action, Sci-Fi",6.8,$25.00M,Michael Anderson,"Michael York, Jenny Agutter, Richard Jordan, Roscoe Lee Browne",,,
1441,1441,keeping up with the joneses,2016,PG-13,105 min,"Action, Comedy",5.9,$14.90M,Greg Mottola,"Zach Galifianakis, Isla Fisher, Jon Hamm, Gal Gadot",,,
1442,1442,neighbors,2014,R,97 min,Comedy,6.3,$150.16M,Nicholas Stoller,"Seth Rogen, Rose Byrne, Zac Efron, Lisa Kudrow",,,
1443,1443,trumbo,2015,R,124 min,"Biography, Drama",7.5,$7.86M,Jay Roach,"Bryan Cranston, Diane Lane, Helen Mirren, Louis C.K.",,,
1444,1444,master and commander: the far side of the world,2003,PG-13,138 min,"Action, Adventure, Drama",7.4,$93.93M,Peter Weir,"Russell Crowe, Paul Bettany, Billy Boyd, James D'Arcy",,,
1445,1445,jerry maguire,1996,R,139 min,"Comedy, Drama, Romance",7.3,$153.95M,Cameron Crowe,"Tom Cruise, Cuba Gooding Jr., Rene Zellweger, Kelly Preston",,,
1446,1446,remember the titans,2000,PG,113 min,"Biography, Drama, Sport",7.8,$115.65M,Boaz Yakin,"Denzel Washington, Will Patton, Wood Harris, Ryan Hurst",,,
1447,1447,the longest ride,2015,PG-13,123 min,"Drama, Romance",7.1,$37.43M,George Tillman Jr.,"Scott Eastwood, Britt Robertson, Alan Alda, Jack Huston",,,
1448,1448,casper,1995,PG,100 min,"Comedy, Family, Fantasy",6.1,$100.33M,Brad Silberling,"Bill Pullman, Christina Ricci, Cathy Moriarty, Eric Idle",,,
1449,1449,natural born killers,1994,R,118 min,"Crime, Drama",7.3,$50.28M,Oliver Stone,"Woody Harrelson, Juliette Lewis, Tom Sizemore, Rodney Dangerfield",,,
1450,1450,the do-over,2016,TV-MA,108 min,"Action, Adventure, Comedy",5.7,,Steven Brill,"Adam Sandler, David Spade, Paula Patton, Kathryn Hahn",,,
1451,1451,better watch out,2016,R,89 min,"Horror, Thriller",6.5,$0.02M,Chris Peckover,"Olivia DeJonge, Levi Miller, Ed Oxenbould, Aleks Mikic",,,
1452,1452,the emperor's new groove,2000,G,78 min,"Animation, Adventure, Comedy",7.3,$89.30M,Mark Dindal,"David Spade, John Goodman, Eartha Kitt, Patrick Warburton",,,
1453,1453,serenity,2018,,,"Drama, Thriller",,,Steven Knight,"Diane Lane, Matthew McConaughey, Anne Hathaway, Jason Clarke",,,
1454,1454,annie,2014,PG,118 min,"Comedy, Drama, Family",5.3,$85.91M,Will Gluck,"Quvenzhan Wallis, Cameron Diaz, Jamie Foxx, Rose Byrne",,,
1455,1455,love & other drugs,2010,R,112 min,"Comedy, Drama, Romance",6.7,$32.37M,Edward Zwick,"Jake Gyllenhaal, Anne Hathaway, Judy Greer, Oliver Platt",,,
1456,1456,papillon,1973,R,151 min,"Biography, Crime, Drama",8.0,$53.27M,Franklin J. Schaffner,"Steve McQueen, Dustin Hoffman, Victor Jory, Don Gordon",,,
1457,1457,kubo and the two strings,2016,PG,101 min,"Animation, Action, Adventure",7.8,$48.02M,Travis Knight,"Charlize Theron, Art Parkinson, Matthew McConaughey, Ralph Fiennes",,,
1458,1458,chisum,1970,G,111 min,"Biography, Western",6.9,$6.00M,Andrew V. McLaglen,"John Wayne, Forrest Tucker, Christopher George, Ben Johnson",,,
1459,1459,primal fear,1996,R,129 min,"Crime, Drama, Mystery",7.7,$56.12M,Gregory Hoblit,"Richard Gere, Laura Linney, Edward Norton, John Mahoney",,,
1460,1460,begin again,2013,R,104 min,"Comedy, Drama, Music",7.4,$16.17M,John Carney,"Keira Knightley, Mark Ruffalo, Adam Levine, Hailee Steinfeld",,,
1461,1461,night at the museum: secret of the tomb,2014,PG,98 min,"Adventure, Comedy, Family",6.2,$113.75M,Shawn Levy,"Ben Stiller, Robin Williams, Owen Wilson, Dick Van Dyke",,,
1462,1462,the aviator,2004,PG-13,170 min,"Biography, Drama, History",7.5,$102.61M,Martin Scorsese,"Leonardo DiCaprio, Cate Blanchett, Kate Beckinsale, John C. Reilly",,,
1463,1463,neighbors 2: sorority rising,2016,R,92 min,Comedy,5.7,$55.29M,Nicholas Stoller,"Seth Rogen, Rose Byrne, Zac Efron, Chlo Grace Moretz",,,
1464,1464,the road,2009,R,111 min,"Adventure, Drama",7.3,$0.06M,John Hillcoat,"Viggo Mortensen, Charlize Theron, Kodi Smit-McPhee, Robert Duvall",,,
1465,1465,people like us,2012,PG-13,114 min,"Comedy, Drama",7.1,$12.41M,Alex Kurtzman,"Chris Pine, Elizabeth Banks, Michelle Pfeiffer, Olivia Wilde",,,
1466,1466,the fly,1986,R,96 min,"Drama, Horror, Sci-Fi",7.5,$40.46M,David Cronenberg,"Jeff Goldblum, Geena Davis, John Getz, Joy Boushel",,,
1467,1467,g man ig,2017,Not Rated,105 min,"Drama, Horror, Mystery",6.2,,skar Thr Axelsson,"Jhannes Haukur Jhannesson, Elma Stefania Agustsdottir, Thor Kristjansson, Anna Gunnds Gumundsdttir",,,
1468,1468,perfetti sconosciuti,2016,,97 min,"Comedy, Drama",7.8,,Paolo Genovese,"Giuseppe Battiston, Anna Foglietta, Marco Giallini, Edoardo Leo",,,
1469,1469,6 days,2017,R,94 min,"Action, Drama, History",6.2,,Toa Fraser,"Jamie Bell, Mark Strong, Abbie Cornish, Martin Shaw",,,
1470,1470,ghost,1990,PG-13,127 min,"Drama, Fantasy, Romance",7.0,$217.63M,Jerry Zucker,"Patrick Swayze, Demi Moore, Whoopi Goldberg, Tony Goldwyn",,,
1471,1471,boone: the bounty hunter,2017,TV-14,86 min,"Action, Drama",6.9,,Robert Kirbyson,"John Hennigan, Osric Chau, Spencer Grammer, Jonathan Lipnicki",,,
1472,1472,ted,2012,R,106 min,"Comedy, Fantasy",7.0,$218.82M,Seth MacFarlane,"Mark Wahlberg, Mila Kunis, Seth MacFarlane, Joel McHale",,,
1473,1473,planet terror,2007,Not Rated,105 min,"Action, Comedy, Horror",7.1,,Robert Rodriguez,"Rose McGowan, Freddy Rodrguez, Josh Brolin, Marley Shelton",,,
1474,1474,leviathan,1989,R,98 min,"Adventure, Horror, Mystery",5.8,$15.70M,George P. Cosmatos,"Peter Weller, Richard Crenna, Amanda Pays, Daniel Stern",,,
1475,1475,juno,2007,PG-13,96 min,"Comedy, Drama",7.5,$143.50M,Jason Reitman,"Ellen Page, Michael Cera, Jennifer Garner, Jason Bateman",,,
1476,1476,the purge: election year,2016,R,108 min,"Action, Horror, Sci-Fi",6.0,$79.00M,James DeMonaco,"Frank Grillo, Elizabeth Mitchell, Mykelti Williamson, Joseph Julian Soria",,,
1477,1477,bushwick,2017,TV-MA,94 min,"Action, Adventure",5.2,,"Cary Murnion, Jonathan Milott","Dave Bautista, Brittany Snow, Angelic Zambrana, Jeremie Harris",,,
1478,1478,life of pi,2012,PG,127 min,"Adventure, Drama, Fantasy",7.9,$124.99M,Ang Lee,"Suraj Sharma, Irrfan Khan, Adil Hussain, Tabu",,,
1479,1479,the wrong man,1956,Not Rated,105 min,"Drama, Film-Noir",7.5,,Alfred Hitchcock,"Henry Fonda, Vera Miles, Anthony Quayle, Harold J. Stone",,,
1480,1480,grease 2,1982,PG,115 min,"Comedy, Drama, Musical",4.2,$15.17M,Patricia Birch,"Michelle Pfeiffer, Maxwell Caulfield, Lorna Luft, Maureen Teefy",,,
1481,1481,robin hood: prince of thieves,1991,PG-13,143 min,"Action, Adventure, Drama",6.9,$165.50M,Kevin Reynolds,"Kevin Costner, Morgan Freeman, Mary Elizabeth Mastrantonio, Christian Slater",,,
1482,1482,november criminals,2017,PG-13,85 min,"Crime, Drama, Mystery",5.2,,Sacha Gervasi,"Chlo Grace Moretz, Ansel Elgort, Catherine Keener, David Strathairn",,,
1484,1484,excalibur,1981,PG,140 min,"Adventure, Drama, Fantasy",7.4,$34.97M,John Boorman,"Nigel Terry, Helen Mirren, Nicholas Clay, Cherie Lunghi",,,
1485,1485,fast & furious,2009,PG-13,107 min,"Action, Crime, Thriller",6.6,$155.06M,Justin Lin,"Vin Diesel, Paul Walker, Michelle Rodriguez, Jordana Brewster",,,
1486,1486,rain man,1988,R,133 min,Drama,8.0,$172.83M,Barry Levinson,"Dustin Hoffman, Tom Cruise, Valeria Golino, Gerald R. Molen",,,
1487,1487,the magnificent seven,1960,Approved,128 min,"Action, Adventure, Western",7.8,$4.91M,John Sturges,"Yul Brynner, Steve McQueen, Charles Bronson, Eli Wallach",,,
1488,1488,kung fu panda 3,2016,PG,95 min,"Animation, Action, Adventure",7.1,$143.53M,"Alessandro Carloni, Jennifer Yuh Nelson","Jack Black, Bryan Cranston, Dustin Hoffman, Angelina Jolie",,,
1489,1489,au revoir l-haut,2017,,117 min,"Crime, Drama",7.7,,Albert Dupontel,"Nahuel Prez Biscayart, Albert Dupontel, Laurent Lafitte, Niels Arestrup",,,
1490,1490,the wedding ringer,2015,R,101 min,Comedy,6.7,$64.46M,Jeremy Garelick,"Kevin Hart, Josh Gad, Kaley Cuoco, Affion Crockett",,,
1491,1491,pocahontas,1995,G,81 min,"Animation, Adventure, Drama",6.7,$141.60M,"Mike Gabriel, Eric Goldberg","Mel Gibson, Linda Hunt, Christian Bale, Joe Baker",,,
1493,1493,zack and miri make a porno,2008,R,101 min,"Comedy, Romance",6.6,$31.46M,Kevin Smith,"Seth Rogen, Elizabeth Banks, Craig Robinson, Gerry Bednob",,,
1494,1494,the pacifier,2005,PG,95 min,"Action, Comedy, Drama",5.6,$113.09M,Adam Shankman,"Vin Diesel, Brittany Snow, Max Thieriot, Brad Garrett",,,
1495,1495,the little mermaid,2018,PG,94 min,"Adventure, Drama, Fantasy",,,"Blake Harris, Chris Bouchard","Gina Gershon, William Moseley, Poppy Drayton, Shirley MacLaine",,,
1496,1496,the boy,2016,PG-13,97 min,"Horror, Mystery, Thriller",6.0,$35.79M,William Brent Bell,"Lauren Cohan, Rupert Evans, James Russell, Jim Norton",,,
1497,1497,kidnap,2017,R,95 min,"Action, Crime, Drama",5.9,$30.72M,Luis Prieto,"Halle Berry, Sage Correa, Chris McGinn, Lew Temple",,,
1498,1498,unfaithful,2002,R,124 min,"Drama, Thriller",6.7,$52.80M,Adrian Lyne,"Richard Gere, Diane Lane, Olivier Martinez, Erik Per Sullivan",,,
1499,1499,the fifth estate,2013,R,128 min,"Biography, Drama, Thriller",6.2,$3.25M,Bill Condon,"Benedict Cumberbatch, Daniel Brhl, Carice van Houten, Alicia Vikander",,,
1500,1500,leatherface,2017,R,90 min,"Horror, Thriller",5.0,,"Alexandre Bustillo, Julien Maury","Stephen Dorff, Lili Taylor, Sam Strike, Vanessa Grasse",,,
1501,1501,diner,1982,R,110 min,"Comedy, Drama",7.2,$14.10M,Barry Levinson,"Steve Guttenberg, Mickey Rourke, Kevin Bacon, Daniel Stern",,,
1502,1502,super 8,2011,PG-13,112 min,"Mystery, Sci-Fi, Thriller",7.0,$127.00M,J.J. Abrams,"Elle Fanning, AJ Michalka, Kyle Chandler, Joel Courtney",,,
1503,1503,the mercy,2018,,112 min,"Biography, Drama",6.1,,James Marsh,"Rachel Weisz, David Thewlis, Colin Firth, Andrew Buchan",,,
1504,1504,furlough,2018,R,83 min,Comedy,5.2,,Laurie Collyer,"Tessa Thompson, Anna Paquin, Whoopi Goldberg, Melissa Leo",,,
1505,1505,the secret life of walter mitty,2013,PG,114 min,"Adventure, Comedy, Drama",7.3,$58.24M,Ben Stiller,"Ben Stiller, Kristen Wiig, Jon Daly, Kathryn Hahn",,,
1506,1506,the happytime murders,2018,,,"Comedy, Crime, Fantasy",,,Brian Henson,"Elizabeth Banks, Melissa McCarthy, Joel McHale, Maya Rudolph",,,
1507,1507,how to be single,2016,R,110 min,"Comedy, Romance",6.1,$46.81M,Christian Ditter,"Dakota Johnson, Rebel Wilson, Leslie Mann, Alison Brie",,,
1508,1508,sunshine,2007,R,107 min,"Adventure, Sci-Fi, Thriller",7.3,$3.68M,Danny Boyle,"Cillian Murphy, Rose Byrne, Chris Evans, Cliff Curtis",,,
1509,1509,atlantic rim: resurrection,2018,,85 min,"Action, Sci-Fi",1.7,,Jared Cohn,"Steve Richard Harris, Jared Cohn, Lindsay Elston, Jenna Enns",,,
1510,1510,the counselor,2013,R,117 min,"Crime, Drama, Thriller",5.3,$16.97M,Ridley Scott,"Michael Fassbender, Penlope Cruz, Cameron Diaz, Javier Bardem",,,
1511,1511,the count of monte cristo,2002,PG-13,131 min,"Action, Adventure, Drama",7.8,$54.23M,Kevin Reynolds,"Jim Caviezel, Guy Pearce, Richard Harris, James Frain",,,
1512,1512,captain phillips,2013,PG-13,134 min,"Biography, Drama, Thriller",7.8,$107.10M,Paul Greengrass,"Tom Hanks, Barkhad Abdi, Barkhad Abdirahman, Catherine Keener",,,
1513,1513,hotel transylvania,2012,PG,91 min,"Animation, Comedy, Family",7.1,$148.31M,Genndy Tartakovsky,"Adam Sandler, Kevin James, Andy Samberg, Selena Gomez",,,
1514,1514,song to song,2017,R,129 min,"Drama, Music, Romance",5.8,$0.44M,Terrence Malick,"Ryan Gosling, Rooney Mara, Michael Fassbender, Natalie Portman",,,
1515,1515,grindhouse,2007,R,191 min,"Action, Horror, Thriller",7.6,$25.03M,"Robert Rodriguez, Eli Roth, Quentin Tarantino, Edgar Wright, Rob Zombie","Kurt Russell, Rose McGowan, Danny Trejo, Zo Bell",,,
1516,1516,contraband,2012,R,109 min,"Action, Crime, Drama",6.5,$66.53M,Baltasar Kormkur,"Mark Wahlberg, Giovanni Ribisi, Kate Beckinsale, Robert Wahlberg",,,
1517,1517,rise of the guardians,2012,PG,97 min,"Animation, Adventure, Family",7.3,$103.41M,Peter Ramsey,"Hugh Jackman, Alec Baldwin, Isla Fisher, Chris Pine",,,
