,movie_no,movie_name,movie_year,movie_certificate,movie_runtime,movie_genre,movie_score,movie_gross,movie_director,movie_star,movie_writer,tomatoter,audience
672,672,assassin's creed,2016,PG-13,115 min,"Action, Adventure, Fantasy",5.8,$54.65M,Justin Kurzel,"Michael Fassbender, Marion Cotillard, Jeremy Irons, Brendan Gleeson",,,
673,673,the little mermaid,1989,G,83 min,"Animation, Family, Fantasy",7.6,$111.54M,"Ron Clements, John Musker","Jodi Benson, Samuel E. Wright, Rene Auberjonois, Christopher Daniel Barnes",,,
674,674,over the hedge,2006,PG,83 min,"Animation, Adventure, Comedy",6.7,$155.02M,"Tim Johnson, Karey Kirkpatrick","Bruce Willis, Garry Shandling, Steve Carell, Wanda Sykes",,,
675,675,splendor in the grass,1961,Not Rated,124 min,"Drama, Romance",7.8,$8.72M,Elia Kazan,"Natalie Wood, Warren Beatty, Pat Hingle, Audrey Christie",,,
676,676,almost famous,2000,R,122 min,"Adventure, Comedy, Drama",7.9,$32.53M,Cameron Crowe,"Billy Crudup, Patrick Fugit, Kate Hudson, Frances McDormand",,,
677,677,now you see me 2,2016,PG-13,129 min,"Action, Adventure, Comedy",6.5,$65.08M,Jon M. Chu,"Jesse Eisenberg, Mark Ruffalo, Woody Harrelson, Dave Franco",,,
678,678,kick-ass 2,2013,R,103 min,"Action, Comedy, Crime",6.6,$28.80M,Jeff Wadlow,"Aaron Taylor-Johnson, Chlo Grace Moretz, Christopher Mintz-Plasse, Jim Carrey",,,
679,679,there's something about mary,1998,R,119 min,"Comedy, Romance",7.1,$176.48M,"Bobby Farrelly, Peter Farrelly","Cameron Diaz, Matt Dillon, Ben Stiller, Lee Evans",,,
680,680,finding nemo,2003,G,100 min,"Animation, Adventure, Comedy",8.1,$380.84M,"Andrew Stanton, Lee Unkrich","Albert Brooks, Ellen DeGeneres, Alexander Gould, Willem Dafoe",,,
681,681,the perks of being a wallflower,2012,PG-13,102 min,"Drama, Romance",8.0,$17.74M,Stephen Chbosky,"Logan Lerman, Emma Watson, Ezra Miller, Paul Rudd",,,
682,682,indiana jones and the temple of doom,1984,PG,118 min,"Action, Adventure",7.6,$179.87M,Steven Spielberg,"Harrison Ford, Kate Capshaw, Jonathan Ke Quan, Amrish Puri",,,
683,683,first man,2018,,,"Biography, Drama, History",,,Damien Chazelle,"Claire Foy, Ryan Gosling, Jon Bernthal, Pablo Schreiber",,,
684,684,love actually,2003,R,135 min,"Comedy, Drama, Romance",7.6,$59.70M,Richard Curtis,"Hugh Grant, Martine McCutcheon, Liam Neeson, Laura Linney",,,
685,685,american sniper,2014,R,133 min,"Action, Biography, Drama",7.3,$350.13M,Clint Eastwood,"Bradley Cooper, Sienna Miller, Kyle Gallner, Cole Konis",,,
686,686,the lobster,2015,R,119 min,"Comedy, Drama, Romance",7.1,$8.70M,Yorgos Lanthimos,"Colin Farrell, Rachel Weisz, Jessica Barden, Olivia Colman",,,
687,687,death proof,2007,Not Rated,113 min,"Action, Thriller",7.1,,Quentin Tarantino,"Kurt Russell, Zo Bell, Rosario Dawson, Vanessa Ferlito",,,
688,688,american psycho,2000,R,102 min,"Crime, Drama",7.6,$15.07M,Mary Harron,"Christian Bale, Justin Theroux, Josh Lucas, Bill Sage",,,
689,689,silence,2016,R,161 min,"Adventure, Drama, History",7.2,$7.08M,Martin Scorsese,"Andrew Garfield, Adam Driver, Liam Neeson, Tadanobu Asano",,,
690,690,my cousin rachel,2017,PG-13,106 min,"Drama, Mystery, Romance",6.0,$2.68M,Roger Michell,"Rachel Weisz, Sam Claflin, Holliday Grainger, Iain Glen",,,
691,691,the lego batman movie,2017,PG,104 min,"Animation, Action, Adventure",7.3,$175.75M,Chris McKay,"Will Arnett, Michael Cera, Rosario Dawson, Ralph Fiennes",,,
692,692,the amazing spider-man 2,2014,PG-13,142 min,"Action, Adventure, Sci-Fi",6.7,$202.85M,Marc Webb,"Andrew Garfield, Emma Stone, Jamie Foxx, Paul Giamatti",,,
693,693,exodus: gods and kings,2014,PG-13,150 min,"Action, Adventure, Drama",6.0,$65.01M,Ridley Scott,"Christian Bale, Joel Edgerton, Ben Kingsley, Sigourney Weaver",,,
694,694,the town,2010,R,125 min,"Crime, Drama, Thriller",7.6,$92.19M,Ben Affleck,"Ben Affleck, Rebecca Hall, Jon Hamm, Jeremy Renner",,,
695,695,alita: battle angel,2018,,,"Action, Adventure, Romance",,,Robert Rodriguez,"Jennifer Connelly, Rosa Salazar, Eiza Gonzlez, Ed Skrein",,,
696,696,gnomeo & juliet,2011,G,84 min,"Animation, Comedy, Family",6.0,$99.97M,Kelly Asbury,"James McAvoy, Emily Blunt, Maggie Smith, Ashley Jensen",,,
697,697,sausage party,2016,R,89 min,"Animation, Adventure, Comedy",6.2,$97.66M,"Greg Tiernan, Conrad Vernon","Seth Rogen, Kristen Wiig, Jonah Hill, Alistair Abell",,,
698,698,dangal,2016,Not Rated,161 min,"Action, Biography, Drama",8.6,$12.39M,Nitesh Tiwari,"Aamir Khan, Sakshi Tanwar, Fatima Sana Shaikh, Sanya Malhotra",,,
699,699,stronger,2017,R,119 min,"Biography, Drama",7.0,$4.21M,David Gordon Green,"Jake Gyllenhaal, Tatiana Maslany, Miranda Richardson, Richard Lane Jr.",,,
700,700,suicide squad 2,2019,,,"Action, Adventure, Fantasy",,,Gavin O'Connor,"Margot Robbie, Dwayne Johnson, Will Smith, Joel Kinnaman",,,
701,701,chitty chitty bang bang,1968,G,144 min,"Adventure, Family, Fantasy",6.9,,Ken Hughes,"Dick Van Dyke, Sally Ann Howes, Lionel Jeffries, Benny Hill",,,
702,702,crash,2004,R,112 min,"Crime, Drama, Thriller",7.8,$54.58M,Paul Haggis,"Don Cheadle, Sandra Bullock, Thandie Newton, Karina Arroyave",,,
703,703,pearl harbor,2001,PG-13,183 min,"Action, Drama, History",6.1,$198.54M,Michael Bay,"Ben Affleck, Kate Beckinsale, Josh Hartnett, William Lee Scott",,,
704,704,the first purge,2018,,,"Action, Horror, Sci-Fi",,,Gerard McMurray,"Marisa Tomei, Lex Scott Davis, Luna Lauren Velez, Melonie Diaz",,,
705,705,fifty shades darker,2017,R,118 min,"Drama, Romance",4.6,$114.38M,James Foley,"Dakota Johnson, Jamie Dornan, Eric Johnson, Eloise Mumford",,,
706,706,x: first class,2011,PG-13,131 min,"Action, Adventure, Sci-Fi",7.8,$146.41M,Matthew Vaughn,"James McAvoy, Michael Fassbender, Jennifer Lawrence, Kevin Bacon",,,
707,707,oldeuboi,2003,R,120 min,"Action, Drama, Mystery",8.4,$0.71M,Chan-wook Park,"Min-sik Choi, Ji-tae Yu, Hye-jeong Kang, Dae-han Ji",,,
708,708,children of men,2006,R,109 min,"Drama, Sci-Fi, Thriller",7.9,$35.55M,Alfonso Cuarn,"Julianne Moore, Clive Owen, Chiwetel Ejiofor, Michael Caine",,,
709,709,revolutionary road,2008,R,119 min,"Drama, Romance",7.3,$22.91M,Sam Mendes,"Leonardo DiCaprio, Kate Winslet, Christopher Fitzgerald, Jonathan Roumie",,,
710,710,jeepers creepers iii,2017,Not Rated,100 min,"Horror, Mystery, Thriller",4.2,$2.24M,Victor Salva,"Stan Shaw, Gabrielle Haugh, Brandon Smith, Meg Foster",,,
711,711,inconceivable,2017,R,105 min,"Drama, Thriller",5.3,,Jonathan Baker,"Gina Gershon, Nicky Whelan, Nicolas Cage, Sienna Soho Baker",,,
712,712,the godfather: part iii,1990,R,162 min,"Crime, Drama",7.6,$66.67M,Francis Ford Coppola,"Al Pacino, Diane Keaton, Andy Garcia, Talia Shire",,,
713,713,nightcrawler,2014,R,118 min,"Crime, Drama, Thriller",7.9,$32.38M,Dan Gilroy,"Jake Gyllenhaal, Rene Russo, Bill Paxton, Riz Ahmed",,,
714,714,the robe,1953,Unrated,135 min,"Drama, History",6.8,$36.00M,Henry Koster,"Richard Burton, Jean Simmons, Victor Mature, Michael Rennie",,,
715,715,x-men origins: wolverine,2009,PG-13,107 min,"Action, Adventure, Sci-Fi",6.6,$179.88M,Gavin Hood,"Hugh Jackman, Liev Schreiber, Ryan Reynolds, Danny Huston",,,
716,716,american hustle,2013,R,138 min,"Crime, Drama",7.3,$150.12M,David O. Russell,"Christian Bale, Amy Adams, Bradley Cooper, Jennifer Lawrence",,,
717,717,jupiter ascending,2015,PG-13,127 min,"Action, Adventure, Sci-Fi",5.3,$47.39M,"Lana Wachowski, Lilly Wachowski","Channing Tatum, Mila Kunis, Eddie Redmayne, Sean Bean",,,
718,718,legend,2015,R,132 min,"Biography, Crime, Drama",7.0,$1.87M,Brian Helgeland,"Tom Hardy, Emily Browning, Taron Egerton, Paul Anderson",,,
719,719,men in black,1997,PG-13,98 min,"Adventure, Comedy, Family",7.3,$250.69M,Barry Sonnenfeld,"Tommy Lee Jones, Will Smith, Linda Fiorentino, Vincent D'Onofrio",,,
720,720,noah,2014,PG-13,138 min,"Action, Adventure, Drama",5.8,$101.20M,Darren Aronofsky,"Russell Crowe, Jennifer Connelly, Anthony Hopkins, Emma Watson",,,
721,721,the sixth sense,1999,PG-13,107 min,"Drama, Mystery, Thriller",8.1,$293.51M,M. Night Shyamalan,"Bruce Willis, Haley Joel Osment, Toni Collette, Olivia Williams",,,
722,722,creed ii,2018,,,"Action, Drama, Sport",,,Steven Caple Jr.,"Tessa Thompson, Michael B. Jordan, Sylvester Stallone, Dolph Lundgren",,,
723,723,the phantom of the opera,2004,PG-13,143 min,"Drama, Musical, Romance",7.3,$51.27M,Joel Schumacher,"Gerard Butler, Emmy Rossum, Patrick Wilson, Miranda Richardson",,,
724,724,lucky,2017,Not Rated,88 min,"Comedy, Drama",7.4,$0.96M,John Carroll Lynch,"Harry Dean Stanton, David Lynch, Ron Livingston, Ed Begley Jr.",,,
725,725,the nutcracker and the four realms,2018,,,"Adventure, Family, Fantasy",,,Lasse Hallstrm,"Keira Knightley, Morgan Freeman, Mackenzie Foy, Helen Mirren",,,
726,726,gangs of new york,2002,R,167 min,"Crime, Drama",7.5,$77.81M,Martin Scorsese,"Leonardo DiCaprio, Cameron Diaz, Daniel Day-Lewis, Jim Broadbent",,,
727,727,cruel intentions,1999,R,97 min,"Drama, Romance",6.8,$38.33M,Roger Kumble,"Sarah Michelle Gellar, Ryan Phillippe, Reese Witherspoon, Selma Blair",,,
728,728,in bruges,2008,R,107 min,"Comedy, Crime, Drama",7.9,$7.76M,Martin McDonagh,"Colin Farrell, Brendan Gleeson, Ciarn Hinds, Elizabeth Berrington",,,
730,730,from dusk till dawn,1996,R,108 min,"Action, Crime, Horror",7.3,$25.75M,Robert Rodriguez,"Harvey Keitel, George Clooney, Juliette Lewis, Quentin Tarantino",,,
731,731,the equalizer 2,2018,,,"Action, Crime, Thriller",,,Antoine Fuqua,"Denzel Washington, Pedro Pascal, Bill Pullman, Melissa Leo",,,
732,732,before i fall,2017,PG-13,98 min,"Drama, Mystery",6.4,$12.23M,Ry Russo-Young,"Zoey Deutch, Halston Sage, Cynthy Wu, Medalion Rahimi",,,
733,733,don't breathe,2016,R,88 min,"Crime, Horror, Thriller",7.1,$89.22M,Fede Alvarez,"Stephen Lang, Jane Levy, Dylan Minnette, Daniel Zovatto",,,
734,734,the curious case of benjamin button,2008,PG-13,166 min,"Drama, Fantasy, Romance",7.8,$127.51M,David Fincher,"Brad Pitt, Cate Blanchett, Tilda Swinton, Julia Ormond",,,
735,735,now you see me,2013,PG-13,115 min,"Crime, Mystery, Thriller",7.3,$117.72M,Louis Leterrier,"Jesse Eisenberg, Common, Mark Ruffalo, Woody Harrelson",,,
736,736,pretty woman,1990,R,119 min,"Comedy, Romance",7.0,$178.41M,Garry Marshall,"Richard Gere, Julia Roberts, Jason Alexander, Laura San Giacomo",,,
737,737,mary poppins,1964,G,139 min,"Comedy, Family, Fantasy",7.8,$102.27M,Robert Stevenson,"Julie Andrews, Dick Van Dyke, David Tomlinson, Glynis Johns",,,
738,738,star wars: episode v - the empire strikes back,1980,PG,124 min,"Action, Adventure, Fantasy",8.8,$290.48M,Irvin Kershner,"Mark Hamill, Harrison Ford, Carrie Fisher, Billy Dee Williams",,,
739,739,focus,2015,R,105 min,"Comedy, Crime, Drama",6.6,$53.86M,"Glenn Ficarra, John Requa","Will Smith, Margot Robbie, Rodrigo Santoro, Adrian Martinez",,,
740,740,the descent,2005,R,99 min,"Adventure, Horror, Thriller",7.2,$26.02M,Neil Marshall,"Shauna Macdonald, Natalie Mendoza, Alex Reid, Saskia Mulder",,,
741,741,slender man,2018,,,Horror,,,Sylvain White,"Joey King, Annalise Basso, Javier Botet, Julia Goldani Telles",,,
742,742,beirut,2018,R,109 min,"Drama, Thriller",4.8,,Brad Anderson,"Rosamund Pike, Jon Hamm, Mark Pellegrino, Dean Norris",,,
743,743,dirty dancing,1987,PG-13,100 min,"Drama, Music, Romance",6.9,$63.95M,Emile Ardolino,"Patrick Swayze, Jennifer Grey, Jerry Orbach, Cynthia Rhodes",,,
744,744,step brothers,2008,R,98 min,Comedy,6.9,$100.47M,Adam McKay,"Will Ferrell, John C. Reilly, Mary Steenburgen, Richard Jenkins",,,
745,745,shrek,2001,PG,90 min,"Animation, Adventure, Comedy",7.9,$267.67M,"Andrew Adamson, Vicky Jenson","Mike Myers, Eddie Murphy, Cameron Diaz, John Lithgow",,,
746,746,star wars: episode vi - return of the jedi,1983,PG,131 min,"Action, Adventure, Fantasy",8.3,$309.13M,Richard Marquand,"Mark Hamill, Harrison Ford, Carrie Fisher, Billy Dee Williams",,,
747,747,mamma mia!,2008,PG-13,108 min,"Comedy, Musical, Romance",6.4,$144.13M,Phyllida Lloyd,"Meryl Streep, Pierce Brosnan, Amanda Seyfried, Stellan Skarsgrd",,,
748,748,the great wall,2016,PG-13,103 min,"Action, Adventure, Fantasy",6.0,$45.54M,Yimou Zhang,"Matt Damon, Tian Jing, Willem Dafoe, Andy Lau",,,
749,749,titanic,1953,Not Rated,98 min,"Drama, History, Romance",7.2,$4.91M,Jean Negulesco,"Clifton Webb, Barbara Stanwyck, Robert Wagner, Audrey Dalton",,,
750,750,hellboy,2004,PG-13,122 min,"Action, Fantasy, Horror",6.9,$59.62M,Guillermo del Toro,"Ron Perlman, Doug Jones, Selma Blair, John Hurt",,,
751,751,gold,2016,R,120 min,"Adventure, Drama, Thriller",6.7,$7.22M,Stephen Gaghan,"Matthew McConaughey, Edgar Ramrez, Bryce Dallas Howard, Corey Stoll",,,
752,752,tombstone,1993,R,130 min,"Action, Biography, Drama",7.8,$56.51M,"George P. Cosmatos, Kevin Jarre","Kurt Russell, Val Kilmer, Sam Elliott, Bill Paxton",,,
753,753,newness,2017,,112 min,"Drama, Romance",6.4,,Drake Doremus,"Nicholas Hoult, Laia Costa, Danny Huston, Courtney Eaton",,,
754,754,zombieland,2009,R,88 min,"Adventure, Comedy, Horror",7.7,$75.59M,Ruben Fleischer,"Jesse Eisenberg, Emma Stone, Woody Harrelson, Abigail Breslin",,,
755,755,miss sloane,2016,R,132 min,"Drama, Thriller",7.5,$3.44M,John Madden,"Jessica Chastain, Mark Strong, Gugu Mbatha-Raw, Michael Stuhlbarg",,,
756,756,the hobbit: the desolation of smaug,2013,PG-13,161 min,"Adventure, Fantasy",7.9,$258.37M,Peter Jackson,"Ian McKellen, Martin Freeman, Richard Armitage, Ken Stott",,,
757,757,lean on pete,2017,R,121 min,"Adventure, Drama",7.2,,Andrew Haigh,"Travis Fimmel, Charlie Plummer, Chlo Sevigny, Steve Zahn",,,
758,758,the last stand,2013,R,107 min,"Action, Comedy, Crime",6.4,$12.05M,Jee-woon Kim,"Arnold Schwarzenegger, Forest Whitaker, Johnny Knoxville, Rodrigo Santoro",,,
759,759,aladdin,1992,G,90 min,"Animation, Adventure, Comedy",8.0,$217.35M,"Ron Clements, John Musker","Scott Weinger, Robin Williams, Linda Larkin, Jonathan Freeman",,,
760,760,josie,2018,,100 min,"Drama, Thriller",4.6,,Eric England,"Sophie Turner, Dylan McDermott, Daeg Faerch, Jack Kilmer",,,
761,761,total recall,1990,R,113 min,"Action, Sci-Fi, Thriller",7.5,$119.39M,Paul Verhoeven,"Arnold Schwarzenegger, Sharon Stone, Michael Ironside, Rachel Ticotin",,,
762,762,the pirates of somalia,2017,R,116 min,"Biography, Drama",6.8,,Bryan Buckley,"Al Pacino, Evan Peters, Melanie Griffith, Barkhad Abdi",,,
763,763,mulan,1998,G,88 min,"Animation, Adventure, Family",7.6,$120.62M,"Tony Bancroft, Barry Cook","Ming-Na Wen, Eddie Murphy, BD Wong, Miguel Ferrer",,,
764,764,american ultra,2015,R,96 min,"Action, Comedy, Sci-Fi",6.1,$14.43M,Nima Nourizadeh,"Jesse Eisenberg, Kristen Stewart, Connie Britton, John Leguizamo",,,
765,765,snatched,2017,R,90 min,"Action, Comedy",4.4,$45.83M,Jonathan Levine,"Amy Schumer, Goldie Hawn, Kim Caramele, Raven Goodwin",,,
766,766,not another teen movie,2001,R,89 min,Comedy,5.7,$38.25M,Joel Gallen,"Chyler Leigh, Jaime Pressly, Chris Evans, Eric Christian Olsen",,,
767,767,the machinist,2004,R,101 min,"Drama, Thriller",7.7,$1.08M,Brad Anderson,"Christian Bale, Jennifer Jason Leigh, Aitana Snchez-Gijn, John Sharian",,,
768,768,the week of,2018,,,Comedy,,,Robert Smigel,"Adam Sandler, Whitney Rae Grandell, Steve Buscemi, Chris Rock",,,
769,769,the 5th wave,2016,PG-13,112 min,"Action, Adventure, Sci-Fi",5.2,$34.91M,J Blakeson,"Chlo Grace Moretz, Matthew Zuk, Gabriela Lopez, Bailey Anne Borders",,,
770,770,life is beautiful,1997,PG-13,116 min,"Comedy, Drama, War",8.6,$57.60M,Roberto Benigni,"Roberto Benigni, Nicoletta Braschi, Giorgio Cantarini, Giustino Durano",,,
771,771,the expendables 3,2014,PG-13,126 min,"Action, Adventure, Thriller",6.1,$39.32M,Patrick Hughes,"Sylvester Stallone, Jason Statham, Jet Li, Antonio Banderas",,,
772,772,the neon demon,2016,R,118 min,"Horror, Thriller",6.2,$1.33M,Nicolas Winding Refn,"Elle Fanning, Christina Hendricks, Keanu Reeves, Karl Glusman",,,
773,773,a cure for wellness,2016,R,146 min,"Drama, Fantasy, Horror",6.4,$8.11M,Gore Verbinski,"Dane DeHaan, Jason Isaacs, Mia Goth, Ivo Nandi",,,
774,774,the prince of egypt,1998,PG,99 min,"Animation, Adventure, Drama",7.0,$101.22M,"Brenda Chapman, Steve Hickner, Simon Wells","Val Kilmer, Ralph Fiennes, Michelle Pfeiffer, Sandra Bullock",,,
775,775,2012,2009,PG-13,158 min,"Action, Adventure, Sci-Fi",5.8,$166.11M,Roland Emmerich,"John Cusack, Thandie Newton, Chiwetel Ejiofor, Amanda Peet",,,
776,776,conan the barbarian,1982,R,129 min,"Adventure, Fantasy",6.9,$39.57M,John Milius,"Arnold Schwarzenegger, James Earl Jones, Max von Sydow, Sandahl Bergman",,,
777,777,mortal engines,2018,,,"Action, Fantasy, Sci-Fi",,,Christian Rivers,"Hugo Weaving, Stephen Lang, Robert Sheehan, Frankie Adams",,,
778,778,unbreakable,2000,PG-13,106 min,"Drama, Mystery, Sci-Fi",7.2,$95.01M,M. Night Shyamalan,"Bruce Willis, Samuel L. Jackson, Robin Wright, Spencer Treat Clark",,,
779,779,napoleon dynamite,2004,PG,96 min,Comedy,6.9,$44.54M,Jared Hess,"Jon Heder, Efren Ramirez, Jon Gries, Aaron Ruell",,,
780,780,the guernsey literary and potato peel pie society,2018,,124 min,"Drama, History, Romance",,,Mike Newell,"Lily James, Matthew Goode, Jessica Brown Findlay, Michiel Huisman",,,
781,781,the terminator,1984,R,107 min,"Action, Sci-Fi",8.0,$38.40M,James Cameron,"Arnold Schwarzenegger, Linda Hamilton, Michael Biehn, Paul Winfield",,,
782,782,ghostland,2018,,91 min,Horror,6.5,,Pascal Laugier,"Crystal Reed, Anastasia Phillips, Emilia Jones, Taylor Hickson",,,
783,783,old school,2003,R,88 min,Comedy,7.1,$75.59M,Todd Phillips,"Luke Wilson, Vince Vaughn, Will Ferrell, Jeremy Piven",,,
784,784,the lost boys,1987,R,97 min,"Comedy, Horror",7.3,$32.22M,Joel Schumacher,"Jason Patric, Corey Haim, Dianne Wiest, Barnard Hughes",,,
785,785,the belko experiment,2016,R,89 min,"Action, Horror, Thriller",6.1,$10.16M,Greg McLean,"John Gallagher Jr., Tony Goldwyn, Adria Arjona, John C. McGinley",,,
786,786,monster,2003,R,109 min,"Biography, Crime, Drama",7.3,$34.47M,Patty Jenkins,"Charlize Theron, Christina Ricci, Bruce Dern, Lee Tergesen",,,
787,787,seven psychopaths,2012,R,110 min,"Comedy, Crime",7.2,$15.02M,Martin McDonagh,"Colin Farrell, Woody Harrelson, Sam Rockwell, Christopher Walken",,,
788,788,indiana jones and the kingdom of the crystal skull,2008,PG-13,122 min,"Action, Adventure, Fantasy",6.2,$317.10M,Steven Spielberg,"Harrison Ford, Cate Blanchett, Shia LaBeouf, Karen Allen",,,
789,789,star wars: episode iii - revenge of the sith,2005,PG-13,140 min,"Action, Adventure, Fantasy",7.6,$380.26M,George Lucas,"Hayden Christensen, Natalie Portman, Ewan McGregor, Samuel L. Jackson",,,
790,790,world war z,2013,PG-13,116 min,"Action, Adventure, Horror",7.0,$202.36M,Marc Forster,"Brad Pitt, Mireille Enos, Daniella Kertesz, James Badge Dale",,,
791,791,safe haven,2013,PG-13,115 min,"Drama, Romance, Thriller",6.7,$71.35M,Lasse Hallstrm,"Julianne Hough, Josh Duhamel, Cobie Smulders, David Lyons",,,
792,792,casino royale,2006,PG-13,144 min,"Action, Adventure, Thriller",8.0,$167.45M,Martin Campbell,"Daniel Craig, Eva Green, Judi Dench, Jeffrey Wright",,,
793,793,black hawk down,2001,R,144 min,"Drama, History, War",7.7,$108.64M,Ridley Scott,"Josh Hartnett, Ewan McGregor, Tom Sizemore, Eric Bana",,,
794,794,pirates of the caribbean: on stranger tides,2011,PG-13,136 min,"Action, Adventure, Fantasy",6.6,$241.07M,Rob Marshall,"Johnny Depp, Penlope Cruz, Ian McShane, Geoffrey Rush",,,
795,795,the birds,1963,PG-13,119 min,"Drama, Horror, Mystery",7.7,$11.40M,Alfred Hitchcock,"Rod Taylor, Tippi Hedren, Jessica Tandy, Suzanne Pleshette",,,
796,796,mrs. doubtfire,1993,PG-13,125 min,"Comedy, Drama, Family",6.9,$219.20M,Chris Columbus,"Robin Williams, Sally Field, Pierce Brosnan, Harvey Fierstein",,,
797,797,motherless brooklyn,2019,,,"Crime, Drama",,,Edward Norton,"Leslie Mann, Bruce Willis, Bobby Cannavale, Gugu Mbatha-Raw",,,
798,798,white boy rick,2018,,,"Crime, Drama",,,Yann Demange,"Jennifer Jason Leigh, Matthew McConaughey, Eddie Marsan, Bel Powley",,,
799,799,bone tomahawk,2015,Not Rated,132 min,"Adventure, Drama, Horror",7.1,,S. Craig Zahler,"Kurt Russell, Patrick Wilson, Matthew Fox, Richard Jenkins",,,
800,800,dead poets society,1989,PG,128 min,"Comedy, Drama",8.1,$95.86M,Peter Weir,"Robin Williams, Robert Sean Leonard, Ethan Hawke, Josh Charles",,,
801,801,warrior,2011,PG-13,140 min,"Drama, Sport",8.2,$13.66M,Gavin O'Connor,"Tom Hardy, Nick Nolte, Joel Edgerton, Jennifer Morrison",,,
802,802,the exorcist,1973,R,122 min,Horror,8.0,$232.91M,William Friedkin,"Ellen Burstyn, Max von Sydow, Linda Blair, Lee J. Cobb",,,
803,803,spy,2015,R,119 min,"Action, Comedy, Crime",7.0,$110.83M,Paul Feig,"Melissa McCarthy, Rose Byrne, Jude Law, Jason Statham",,,
804,804,chaos walking,2019,,,Sci-Fi,,,Doug Liman,"Daisy Ridley, Tom Holland, Nick Jonas, Mads Mikkelsen",,,
805,805,allegiant,2016,PG-13,120 min,"Action, Adventure, Mystery",5.7,$66.18M,Robert Schwentke,"Shailene Woodley, Theo James, Jeff Daniels, Naomi Watts",,,
806,806,collateral beauty,2016,PG-13,97 min,"Drama, Romance",6.8,$30.98M,David Frankel,"Will Smith, Edward Norton, Kate Winslet, Michael Pea",,,
807,807,kick-ass,2010,R,117 min,"Action, Comedy",7.6,$48.07M,Matthew Vaughn,"Aaron Taylor-Johnson, Nicolas Cage, Chlo Grace Moretz, Garrett M. Brown",,,
808,808,up in the air,2009,R,109 min,"Drama, Romance",7.4,$83.82M,Jason Reitman,"George Clooney, Vera Farmiga, Anna Kendrick, Jason Bateman",,,
809,809,dracula,1992,R,128 min,Horror,7.5,$82.52M,Francis Ford Coppola,"Gary Oldman, Winona Ryder, Anthony Hopkins, Keanu Reeves",,,
810,810,shaun of the dead,2004,R,99 min,"Comedy, Horror",8.0,$13.54M,Edgar Wright,"Simon Pegg, Nick Frost, Kate Ashfield, Lucy Davis",,,
811,811,king kong,2005,PG-13,187 min,"Action, Adventure, Drama",7.2,$218.08M,Peter Jackson,"Naomi Watts, Jack Black, Adrien Brody, Thomas Kretschmann",,,
812,812,a futile and stupid gesture,2018,TV-MA,101 min,"Biography, Comedy",6.8,,David Wain,"Frank Gingerich, Morgan Gingerich, Annette O'Toole, Harry Groener",,,
813,813,accident man,2018,R,105 min,"Action, Crime, Thriller",6.1,,Jesse V. Johnson,"Scott Adkins, Ray Stevenson, Ashley Greene, David Paymer",,,
814,814,cloverfield,2008,PG-13,85 min,"Action, Horror, Sci-Fi",7.0,$80.05M,Matt Reeves,"Mike Vogel, Jessica Lucas, Lizzy Caplan, T.J. Miller",,,
815,815,the tree of life,2011,PG-13,139 min,"Drama, Fantasy",6.8,$13.30M,Terrence Malick,"Brad Pitt, Sean Penn, Jessica Chastain, Hunter McCracken",,,
816,816,armageddon,1998,PG-13,151 min,"Action, Adventure, Sci-Fi",6.6,$201.57M,Michael Bay,"Bruce Willis, Billy Bob Thornton, Ben Affleck, Liv Tyler",,,
817,817,insurgent,2015,PG-13,119 min,"Action, Adventure, Sci-Fi",6.2,$130.18M,Robert Schwentke,"Shailene Woodley, Ansel Elgort, Theo James, Kate Winslet",,,
818,818,knock knock,2015,R,99 min,"Drama, Horror, Thriller",4.9,$0.04M,Eli Roth,"Keanu Reeves, Lorenza Izzo, Ana de Armas, Aaron Burns",,,
819,819,toy story 3,2010,G,103 min,"Animation, Adventure, Comedy",8.3,$415.00M,Lee Unkrich,"Tom Hanks, Tim Allen, Joan Cusack, Ned Beatty",,,
820,820,need for speed,2014,PG-13,132 min,"Action, Crime, Thriller",6.5,$43.58M,Scott Waugh,"Aaron Paul, Dominic Cooper, Imogen Poots, Kid Cudi",,,
821,821,spinning man,2018,R,100 min,"Drama, Mystery, Thriller",5.3,,Simon Kaijser,"Odeya Rush, Alexandra Shipp, Pierce Brosnan, Minnie Driver",,,
822,822,nerve,2016,PG-13,96 min,"Action, Adventure, Crime",6.6,$38.56M,"Henry Joost, Ariel Schulman","Emma Roberts, Dave Franco, Emily Meade, Miles Heizer",,,
823,823,animal house,1978,R,109 min,Comedy,7.6,$141.60M,John Landis,"John Belushi, Karen Allen, Tom Hulce, Stephen Furst",,,
824,824,dallas buyers club,2013,R,117 min,"Biography, Drama",8.0,$27.30M,Jean-Marc Valle,"Matthew McConaughey, Jennifer Garner, Jared Leto, Steve Zahn",,,
825,825,why him?,2016,R,111 min,Comedy,6.2,$60.27M,John Hamburg,"Zoey Deutch, James Franco, Tangie Ambrose, Cedric the Entertainer",,,
826,826,eurotrip,2004,R,92 min,Comedy,6.6,$17.72M,"Jeff Schaffer, Alec Berg, David Mandel","Scott Mechlowicz, Jacob Pitts, Michelle Trachtenberg, Travis Wester",,,
827,827,apocalypto,2006,R,139 min,"Action, Adventure, Drama",7.8,$50.87M,Mel Gibson,"Gerardo Taracena, Raoul Max Trujillo, Dalia Hernndez, Rudy Youngblood",,,
828,828,the parent trap,1998,PG,128 min,"Adventure, Comedy, Drama",6.5,$66.31M,Nancy Meyers,"Lindsay Lohan, Dennis Quaid, Natasha Richardson, Elaine Hendrix",,,
829,829,red 2,2013,PG-13,116 min,"Action, Comedy, Crime",6.7,$53.26M,Dean Parisot,"Bruce Willis, Helen Mirren, John Malkovich, Anthony Hopkins",,,
830,830,brimstone,2016,R,148 min,"Thriller, Western",7.1,,Martin Koolhoven,"Dakota Fanning, Paul Anderson, Kit Harington, Carice van Houten",,,
831,831,the open house,2018,TV-MA,94 min,"Horror, Thriller",3.3,,"Matt Angel, Suzanne Coote","Dylan Minnette, Piercey Dalton, Patricia Bethune, Sharif Atkins",,,
832,832,kill bill: vol. 2,2004,R,137 min,"Action, Crime, Thriller",8.0,$66.21M,Quentin Tarantino,"Uma Thurman, David Carradine, Michael Madsen, Daryl Hannah",,,
833,833,the lego movie,2014,PG,100 min,"Animation, Action, Adventure",7.8,$257.76M,"Phil Lord, Christopher Miller","Chris Pratt, Will Ferrell, Elizabeth Banks, Will Arnett",,,
834,834,the fault in our stars,2014,PG-13,126 min,"Drama, Romance",7.8,$124.87M,Josh Boone,"Shailene Woodley, Ansel Elgort, Nat Wolff, Laura Dern",,,
835,835,keep watching,2017,R,89 min,"Horror, Thriller",4.4,,Sean Carter,"Bella Thorne, Chandler Riggs, Ioan Gruffudd, Natalie Martinez",,,
836,836,walle,2008,G,98 min,"Animation, Adventure, Family",8.4,$223.81M,Andrew Stanton,"Ben Burtt, Elissa Knight, Jeff Garlin, Fred Willard",,,
837,837,risen,2016,PG-13,107 min,"Action, Adventure, Drama",6.3,$36.87M,Kevin Reynolds,"Joseph Fiennes, Tom Felton, Peter Firth, Cliff Curtis",,,
838,838,grave,2016,R,99 min,"Drama, Horror",7.0,$0.51M,Julia Ducournau,"Garance Marillier, Ella Rumpf, Rabah Nait Oufella, Laurent Lucas",,,
839,839,enemy,2013,R,91 min,"Mystery, Thriller",6.9,$1.01M,Denis Villeneuve,"Jake Gyllenhaal, Mlanie Laurent, Sarah Gadon, Isabella Rossellini",,,
840,840,bring it on,2000,PG-13,98 min,"Comedy, Romance, Sport",6.0,$68.38M,Peyton Reed,"Kirsten Dunst, Eliza Dushku, Jesse Bradford, Gabrielle Union",,,
